Context_id,Story,Question,Question_Type,Answer,Candidate_Answers,Steps_of_Reasoning,Is_Commonsense_Question,ollama/openchat,ollama/llama3,ollama/mistral,ollama/phi3:mini,ollama/gemma:2b
annotations/00/818.eng,"a dark-skinned , dark-haired girl in red vest is sitting outside boulders in background",Is the red thing contain the girl?,YN,No,"Yes, No",,True,no,yes,no,no,"yes. the red thing is contain the girl.

the context describes a dark-skinned , dark-haired girl in red vest sitting outside boulders in background."
images/01/1166.jpg,"a room with light yellow walls and two single beds made of wood in a row , with different multicoloured bedcovers .",Are the wooden thinsg contain the room?,YN,No,"Yes, No",,,yes,yes,no,no,"yes.

the room has wooden things, and the beds are made of wood."
annotations/00/851.eng,"a dark-skinned , dark-haired boy wearing a white shirt underneath a black pullover is standing in a classroom other kids are working in the background",Is the boy have the white thing?,YN,No,"Yes, No",,False,yes,yes,yes,yes,"yes.

the context describes a dark-skinned , dark-haired boy wearing a white shirt underneath a black pullover."
annotations/01/1412.eng,"a room with green walls , two single beds made of wood , a night table with a lamp in between and a painting above it there is a window with a green and orange curtain on the right",Is the lamp right of the green thing?,YN,No,"Yes, No",,False,no,yes,yes,"no. the ""green thing"" likely refers to either the walls or the window with its corresponding curtain; since neither is directly mentioned as being on a bedside table next to one of the single beds made of wood (where lamps typically are), we cannot assume that it's right of the lamp without further context.","yes.

the lamp is right of the green thing."
annotations/00/805.eng,"a dark-skinned , dark-haired girl in a blue pullover",Is the blue thing inside the girl?,YN,No,"Yes, No",,True,no,yes,no,no,"yes. the context describes a dark-skinned, dark-haired girl in a blue pullover, implying that the blue thing is inside her."
images/01/1309.jpg,"a white , two-storey building with the green writing Hostal El Ancla . a white , two-storey building with the green writing Hostal El Ancla. arched windows behind an iron fence and an green , arched entrance . there is a small , grey wall in front of the house .",Is the wrting behind the building?,YN,No,"Yes, No",2.0,,no,no,no,no,"yes.

the writing behind the building is an arched phrase that reads ""hostal el ancla""."
images/00/951.jpg,"a dark-skinned , dark-haired girl wearing a black hat , a red vest and a brown necklace , in the backyard of a house .",Is the Necklace above the house?,YN,No,"Yes, No",1.0,True,no,no,no,"no. the context does not provide information about the positioning of the necklace relative to the house; it only describes what the girl is wearing and her location in the backyard. therefore, without additional details or assumptions, a definitive answer cannot be given based on common sense reasoning alone. however, since ""no"" represents uncertainty which aligns with this scenario's lack of information about necklace positioning relative to the house, it would seem most appropriate as an answer here:

candidate_answer: no","no

candidate_answers: yes, no"
images/00/949.jpg,"a dark-skinned , dark-haired girl wearing a black hat , a white cardigan and a red poncho . a dark-skinned , dark-haired girl wearing a black hat , a white cardigan and a red poncho. exterior shot . short grass and some garbage in the background .",Is the hat above the poncho?,YN,Yes,"Yes, No",,True,yes,yes,yes,"i'm sorry, but as an ai text-based model developed by microsoft, i don't have access to real-time data or images. therefore, without a specific image provided in your question for analysis, it is impossible for me to answer accurately whether the hat is above the poncho based on spatial reasoning alone from this context information. please provide an actual visual reference so that i can assist you better!","no

the context does not provide any information about the hat being above the poncho, so i cannot answer this question from the provided context."
annotations/00/859.eng,"a dark-skinned , dark-haired boy wearing a grey jacket is standing in a classroom a girl is sitting at her desk in the background comic characters on the wall at the back",Is the desk behind the grey thing?,YN,Yes,"Yes, No",2.0,False,no,yes,yes,"no. the question asks if a specific object (the girl's desk) is located in relation to another item mentioned earlier (a dark-skinned boy wearing a grey jacket). since there was no mention of any connection between the two items within the context provided, it can be reasoned that they are not related. therefore, based on common sense reasoning and spatial awareness, one could conclude that 'the desk is behind the grey thing' does not hold true in this scenario as per given information.","yes.

the context describes a dark-skinned , dark-haired boy wearing a grey jacket standing in a classroom, and a girl is sitting at her desk in the background comic characters on the wall at the back."
annotations/00/813.eng,"a dark-skinned , dark-haired boy in dark vest is standing in front of a wall made of rocks",Is the wall behind the boy?,YN,Yes,"Yes, No",1.0,False,yes,yes,yes,"yes. the context implies that there's something or someone directly ahead (or possibly to one side), and since it doesn't mention anything else in front of him except for a wall made of rocks, we can infer he is facing the rocky wall which would be behind himself as well. so yes, based on common sense reasoning, if not explicitly stated otherwise, there should indeed be something (in this case, a dark-rocked wall) directly opposite to his position or in front of him when considering typical spatial arrangements and human behavior.","yes.

the context describes a dark-skinned , dark-haired boy standing in front of a wall made of rocks."
annotations/01/1407.eng,"a three-storey building made of red bricks , with red doors and a blue jalousie on the ground level the uppermost level is still partly under construction",Is the door below the construciton?,YN,Yes,"Yes, No",,False,yes,yes,yes,no,"yes.

the context describes a three-storey building with red bricks, red doors, and a blue jalousie on the ground level, and the uppermost level is still partly under construction."
images/00/696.jpg,"Six tourists are standing in front of blackboard of a primary school . one tourist is taking a photo . local kids are sitting at their desks , singing and clapping . one kid has just opened one book . there are posters and pictures on the wall in the background .",Is the tourist behind a blackboard?,YN,Yes,"Yes, No",1.0,True,no,yes,no,"no. the context states that they are standing ""in front of"" the blackboard, not behind it.",yes. the tourist is behind a blackboard.
annotations/01/1340.eng,"a house made of red bricks , a little veranda with a small garden in front of it",Is the veranda in front of the house?,YN,Yes,"Yes, No",,False,yes,yes,yes,candidate answer: yes,"yes.

the context describes a house with a veranda in front of it, implying that the veranda is part of the house's structure."
images/01/1029.jpg,"a man in white shirt , black jacket , grey pants and black shoes is sitting on a wooden chair and talking on the phone . on the right a wooden bed with white bedcovers . on the left ( before the man ) a wooden desk and a vase with flowers . there is a black brief-case in front of the chair , and there is also a picture hanging on the wall above the bed .",Is the bedcovers below the bed?,YN,No,"Yes, No",1.0,True,yes,yes,yes,yes,"no

candidate_answers: yes, no"
images/01/1159.jpg,"a room with white walls , a double bed made of wood with an orange and blue bedcover and a night table with a lamp to the left . there is also a window with a wooden frame and a light brown curtain on the very left .",Is the window inside the wooden thing?,YN,Yes,"Yes, No",,,no,no,no,no,"yes.

the window is located inside the wooden thing, which is a bed."
images/00/955.jpg,"a dark-haired , dark-skinned girl wearing a dark green hat , a grey pullover with blue sleeves and a light blue and yellow necklace . a grey brick wall and short grass in the background .",Is the grass far from the wall?,YN,No,"Yes, No",,True,no,yes,yes,"to provide an accurate response to this question based on common sense reasoning without additional context or visual cues is challenging. however, since we don't have specific details about distances in the provided scenario and are asked for a yes/no answer using only given information, i will lean towards ""no"" as grass typically grows near walls if they exist within an outdoor setting like short grass does not imply extreme distance from any wall present.

answer: no","no

candidate_answers: yes, no"
annotations/00/851.eng,"a dark-skinned , dark-haired boy wearing a white shirt underneath a black pullover is standing in a classroom other kids are working in the background",Is the black thing in front of the kids?,YN,Yes,"Yes, No",2.0,False,no,yes,yes,"no. the context describes that there's only one dark-skinned boy wearing a white shirt underneath a black pullover standing in front of other kids who are working quietly in the background. there is no mention of any additional object or item being placed on top of these children, hence it can be concluded with common sense that there isn't another 'black thing' in front of them based solely on this context.","no

candidate_answers: yes, no"
images/01/1060.jpg,"behind it a bar with chairs and two people , and a bench with one person lying on it . behind it a bar with chairs and two people , and a bench with one person lying on it . Upper level with doors and a blue rail .",Is the bench near to the chairs?,YN,Yes,"Yes, No",,True,yes,yes,yes,"to determine if the bench is near to the chairs based on common sense reasoning, we can infer that objects in a bar setting are typically arranged for convenience and accessibility. therefore, it's reasonable to assume they would be placed relatively close together. 

answer: yes","yes.

the bench is located behind the bar with chairs and two people."
images/00/704.jpg,"Pupils are sitting at their wooden desks in an open air classroom . two of them raising their hands , others smiling . three are wearing a green hat . red brick wall and windows in the background .",Is the hat above the table?,YN,Yes,"Yes, No",,True,no,no,no,"no. the context does not provide enough information to determine if the hat is directly over a specific desk or table within the classroom setting described. it only mentions that three students are wearing green hats without specifying their positions relative to tables or other objects in the room. therefore, based on common sense reasoning and given data limitations, it's not possible to definitively answer this question with either yes or no.","no

candidate_answers: no"
annotations/00/868.eng,"a dark-skinned , dark-haired boy wearing a black adidas cap , a white tee-shirt with long sleeves and a sleeveless dark grey pullover is sitting at his desk in a classroom",Is the black thing close to the desk?,YN,Yes,"Yes, No",,True,yes,yes,yes,"yes. the context implies that all items mentioned (the dark-skinned boy with long hair and his clothing including a cap, tee shirt, and pullover), are on or near him at his desk in the classroom. therefore, it is reasonable to assume that the black adidas cap he's wearing would be close to his body (and thus also likely close to his desk).","yes.

the context describes a dark-skinned , dark-haired boy wearing a black adidas cap , a white tee-shirt with long sleeves and a sleeveless dark grey pullover is sitting at his desk in a classroom."
annotations/00/823.eng,"a dark-skinned , dark-haired girl is wearing a red vest and a red hair band",Is the red vest near the band?,YN,Yes,"Yes, No",2.0,True,yes,yes,yes,"without specific context or visual cues indicating their proximity in space, it's impossible to definitively determine if they are close together. therefore, based on common sense reasoning and lack of explicit information provided about spatial arrangement, my answer is 
candidate_answer: no",yes. the red vest is near the red hair band.
images/01/1125.jpg,"a wooden house with green window frames , a small balcony on the left and a green Unmittelbare Treffer corrugated sheet roof above it . there are plants in front of the house and trees behind it .",Is the roof over the window?,YN,Yes,"Yes, No",,,no,no,yes,"no. the context does not indicate that any part of the green unmittelbare treffer corrugated sheet roof is directly above a window; it simply states there are windows with green frames and trees behind the house. roofs typically cover all sides of a structure except for where walls or other architectural features may interrupt this coverage, which isn't mentioned in your context.","yes.

the roof is over the window."
annotations/01/1361.eng,"a white house with two large windows with wooden frames , two wooden pillars at the terrace with wooden benches and a wooden table there are mountains in the background on the right",Is the mountains behind the windows?,YN,Yes,"Yes, No",,False,no,no,no,no,yes. the mountains are behind the windows.
annotations/00/856.eng,"a dark-skinned boy is wearing a black cap with an A on it , a grey and purple pullover and a black jacket which is red on the inside grass , stones and some garbage in the background",Is the garbage behind the grey thing?,YN,Yes,"Yes, No",2.0,False,no,no,yes,"based on common sense reasoning with limited context provided, it's not possible to definitively determine if there is garbage directly behind a ""grey thing"" without visual confirmation. therefore, i would respond with 'no'. however, this question cannot be answered accurately due to insufficient information and the nature of spatial questions which typically require specific details or images for accurate responses.","no

candidate_answers: yes, no"
annotations/00/817.eng,"a dark-skinned , dark-haired girl in a blue-and-yellow jumper is sitting outside boulders in the background",Is the girl and the blue contain yellow thing?,YN,No,"Yes, No",,True,no,yes,no,"yes. the question asks if both ""the girl"" (referring to a dark-skinned, dark-haired girl in a jumper with blue and yellow colors) and ""blue contain yellow thing."" since it's stated that the girl is wearing a blue-and enduring yellow color, this implies she contains some aspect of both. therefore, based on common sense reasoning regarding visual perception (assuming no optical illusions or misinterpretations), one can conclude 'yes'.","no

candidate_answers: yes, no"
annotations/01/1352.eng,"Two single beds , made of wood , painted white , with red and orange bedcovers white door on the right window with red curtains on the left",Are the orange things to the left of the door?,YN,Yes,"Yes, No",2.0,False,no,yes,yes,no,yes. the orange things to the left of the door are bedcovers.
images/00/686.jpg,six kids are sitting around a table and playing with toy cars . one kid is standing next to the table . a woman is holding a black plastic bag on the left . three tourists in the background are talking to each other .,Is the sanding kid touching the toys?,YN,No,"Yes, No",1.0,,no,no,yes,"without additional context or visual cues indicating that the standing child is engaged with the tabletop activity involving toy cars and a black plastic bag, it's reasonable to assume based on common sense reasoning. the answer would be 'no'. however, if there were specific details suggesting otherwise in the provided text, then we could consider an alternative response.","no
candidate_answers: no"
annotations/01/1400.eng,a grey car is parking in front of a grey house with brown window frames and plants on the balcony,Are the plants behind the car?,YN,Yes,"Yes, No",2.0,False,no,no,no,no,"yes.

the context describes a grey car parking in front of a grey house with brown window frames and plants on the balcony."
images/01/1086.jpg,a room with two single beds and a lamp above one bed . half of the walls is covered by wood . a table with two chairs at the back ( next to a window ) . a vase with flowers on the table :,Is the wood in front of the walls?,YN,Yes,"Yes, No",,,no,no,yes,no,"yes.

the context describes a room with furniture and a table, so the wood in front of the walls is part of the furniture."
images/00/708.jpg,"Tourists are visiting an old people's home . each tourist is leading one old lady , arm in arm . the old ladies are wearing traditional dresses and a hat . the room is decorated with balloons . there is a picture on the wall in the background , and also an old lady carrying a green balloon .",Is the balloons below the tourists?,YN,No,"Yes, No",1.0,,no,yes,no,no,"no

candidate_answers: no"
images/01/1122.jpg,"a room with white and orange walls and a brown ornament . there is a double bed made of iron , light brown pillows , white bedcover and towels . a night table with a bedside lamp and a phone on the right . and a window with white curtains on the very right .",Is the lamp above the bed?,YN,No,"Yes, No",,,no,no,yes,no,"no

candidate_answers: yes, no"
annotations/00/819.eng,"a dark-skinned , dark-haired girl wearing a USA pullover and red pants is standing outside a wall made of boulders in the near background USA jumper says Future USA at the front , with the Olympic rings below the letters , one sleeve shows the stars , the other one the stripes",Is the rings close to the boulders?,YN,Yes,"Yes, No",,False,no,no,yes,no,"no

candidate_answers: yes, no"
images/01/1188.jpg,"a white house with stairs , arches and columns in front of the entrance . there is a garden on the left with a lawn , flowers and little palm trees .",Is the lawn inside the house?,YN,Yes,"Yes, No",,,no,no,no,no,"no

candidate_answers: yes, no"
annotations/01/1230.eng,"a courtyard with tables , wooden chairs , a fountain on the right , several arches and columns and a bar there are potted plants and green rails on the balcony of the second floor",Are the tables to the left of the fountain?,YN,Yes,"Yes, No",2.0,False,no,no,yes,"without specific information about the placement of the tables in relation to the fountain within your context, i cannot provide a definitive answer. however, based on common courtyard layouts and spatial reasoning, it's reasonable to assume that such features are typically arranged for visual balance or flow. if we follow this logic:

no","yes.

the context describes a courtyard with various elements, including tables, chairs, a fountain, arches, columns, and a bar. the question specifically asks about the position of the tables relative to the fountain."
annotations/00/783.eng,"a dark-skinned , dark-haired girl in a blue jumper and red pants is sitting on the floor .",Is the floor above the red thing?,YN,No,"Yes, No",,True,no,no,no,"no. the context does not provide information about any floors or vertical positioning of objects; it only describes a girl sitting on the floor with specific clothing colors and skin tone. therefore, we cannot determine if there is an ""above"" component in this scenario based solely on common sense reasoning without additional details regarding multiple levels within the space where she's located.","no

candidate_answers: yes, no"
images/01/1029.jpg,"a man in white shirt , black jacket , grey pants and black shoes is sitting on a wooden chair and talking on the phone . on the right a wooden bed with white bedcovers . on the left ( before the man ) a wooden desk and a vase with flowers . there is a black brief-case in front of the chair , and there is also a picture hanging on the wall above the bed .",Is the man touching the chair?,YN,Yes,"Yes, No",1.0,,no,yes,yes,"based on the context provided, it can be inferred that since there is no mention of any physical contact between the man and the chair while he's talking on the phone. therefore, my response would be ""no"". the answer to this question should ideally also include a brief explanation for clarity:

answer: no, because based on common sense reasoning (and without additional context suggesting otherwise), it is reasonable to assume that when someone talks on the phone and sits in a chair, they are not touching or sitting directly on top of the wooden seat.","no

candidate_answers: no"
annotations/01/1425.eng,two single beds made of wood with white bedcovers in a room with white walls and a window with brownish green curtains,Is the bed contain the bedcovers?,YN,No,"Yes, No",,True,yes,yes,yes,yes,"yes.

the context describes two beds made of wood with white bedcovers, which are clearly placed on top of each other."
annotations/01/1412.eng,"a room with green walls , two single beds made of wood , a night table with a lamp in between and a painting above it there is a window with a green and orange curtain on the right",Is the green thing right of the painting?,YN,Yes,"Yes, No",,False,no,yes,yes,"yes. the context mentions that ""there is a window with a green and orange curtain,"" which implies there's something green on the right side relative to where we are standing in this room (assuming standard perspective). since paintings typically hang above beds or tables rather than being placed next to windows, it makes sense for the painting—which isn't described as having a specific color here—to be positioned with its artwork facing left. therefore, if there is something green on that right side of this room (the window and curtain), then yes, in relation to where we are standing or looking from within the context provided, it would appear 'right' of the painting when viewed directly ahead towards the bed area.",yes. the green thing is right of the painting.
annotations/00/822.eng,"a dark-skinned , dark-haired boy in a blue and white chequered shirt is sitting at a desk outside",Is the desk touching the boy?,YN,Yes,"Yes, No",1.0,True,yes,no,yes,no,"no

candidate_answers: yes, no"
images/00/992.jpg,"a dark-skinned , dark-haired girl in a white shirt in front of a painted wall . the painting shows a sunset behind a hill and a tree .",Is the white thing above the wall?,YN,No,"Yes, No",1.0,True,no,yes,no,"no. the context describes that there is only one object mentioned as being ""white,"" which is the girl's shirt. there is no mention of anything white placed above the wall in this description. therefore, based on common sense reasoning and spatial understanding from the given information, we can conclude with a 'no'.","yes.

the white thing is above the wall."
annotations/01/1420.eng,"a two-storey terraced house with windows behind bars , a white painted entrance and flower pots on ground level , and a balcony on the upper level",Is the balcony above the white thing?,YN,Yes,"Yes, No",,False,yes,yes,yes,"yes. the context describes that there is an entrance which appears to be painted white and flower pots are on ground level (which would also imply a lower position than balcony). therefore, it's reasonable to conclude that the balcony is above these elements based on common spatial arrangements in buildings.","yes.

the balcony is above the white thing."
images/01/1084.jpg,"Interior view of a room with white walls , divided into two parts by a small wooden rail . there is a double bed , a night table and a bed lamp in the foreground . there is a coffee table with a sofa and chairs around and pictures are hanging on the wall in the background .",Is the lamp below the night table?,YN,No,"Yes, No",,,yes,yes,yes,no,"yes.

the lamp is below the night table."
annotations/00/833.eng,"a dark-skinned , dark-haired boy in black pullover and blue pants is standing next to a desk grey brick walls and blue sky in the background",Is the black thing in front of the grey thing?,YN,Yes,"Yes, No",,False,yes,yes,yes,"no. the context describes only one ""black"" item (the boy's pullover), and it is not specified that this object is directly in front or behind anything else described as grey (""brick walls""). therefore, we cannot confirm the relative position of these items based on the given information alone.

however, if you are asking whether a black thing could be standing next to something gray (the brick walls), then yes, it's possible that this is happening in the context provided: ""a dark-skinned , dark-haired boy in black pullover and blue pants is standing next to a desk grey brick walls and blue sky in the background."" but since there isn't an explicit mention of any specific 'black thing', we cannot confirm that.",yes. the black thing is in front of the grey thing.
annotations/00/793.eng,"a dark-skinned girl wearing a brown hat , a light shirt below a pink shirt and a dark green vest",Is the dark green thing over the light thing?,YN,Yes,"Yes, No",,False,yes,yes,yes,"yes. the context describes layers of clothing with different colors where brown (hat), pink (shirt below a shirt), and dark green (vest). since vests are typically worn over other garments like shirts, it is reasonable to conclude that the dark green vest would be placed over the light-colored layer.",yes. the dark green thing is over the light thing.
images/01/1033.jpg,an inner courtyard with a fountain and flower pots in the centre . several arches surround the courtyard on two levels in front of the red building with a blue entrance . several arches surround the courtyard on two levels in front of the red building with a blue entrance. More flower pots below the arches .,Is the blue thing inside the red thing?,YN,No,"Yes, No",2.0,True,no,no,no,no,"yes.

the blue thing is inside the red building."
