Context_id,Story,Question,Question_Type,Answer,Candidate_Answers,Steps_of_Reasoning,Is_Commonsense_Question,ollama/openchat,ollama/llama3,ollama/mistral,ollama/phi3:mini,ollama/gemma:2b
images/00/948.jpg,"a dark-haired , dark-skinned boy in a dark green pullover ( with a white bear on it ) in a backyard . a dark-haired , dark-skinned boy in a dark green pullover ( with a white bear on it ) in a backyard. Some garbage lying around in the background .",Are the white thing and green thing touching?,YN,Yes,"Yes, No",1.0,,no,yes,no,no,"no

the context does not provide any information about the white thing and green thing touching, so i cannot answer this question from the provided context."
images/00/690.jpg,"Lots of locals ( both kids and adults ) in front of a blue building . one kid is about to slide down the slide , with one grown up waiting to catch it . another woman is carrying a basket in her left hand , with a kid holding her other hand . others are just sitting around or are standing in the background . there are snow covered mountains in the distant background .",Is the building in front of the snow?,YN,No,"Yes, No",1.0,,no,no,no,"yes. the context implies that it is a location with outdoor activities such as sliding down a slide and carrying baskets on snow-covered mountains in the background; therefore, there's likely to be some building or structure amidst this natural setting where people are gathered for these activities. hence, we can infer that the blue building mentioned must also have its backdrop against the scenic mountainous landscape with snow.","no

the context does not provide any information about the building in front of the snow, so i cannot answer this question from the provided context."
annotations/00/859.eng,"a dark-skinned , dark-haired boy wearing a grey jacket is standing in a classroom a girl is sitting at her desk in the background comic characters on the wall at the back",Is the desk behind the wall?,YN,No,"Yes, No",,False,no,no,no,"no. the question asks if the desk is ""behind"" a specific object (the wall), but in the context provided, there'selfis no mention of any objects being behind each other; only that comic characters are on the back wall and nothing else is described as being positioned relative to it or anywhere near. therefore, we cannot confirm if anything is ""behind"" a specific object based solely on this information.","yes.

the context describes a dark-skinned , dark-haired boy standing in a classroom, and a girl sitting at her desk in the background."
images/01/1326.jpg,"A room with grey walls , two single beds made of wood with grey and brown chequered bedcovers and pillows . A room with grey walls , two single beds made of wood with grey and brown chequered bedcovers and pillows. Night table with a bedside lamp between the two beds . A room with grey walls , two single beds made of wood with grey and brown chequered bedcovers and pillows. Night table with a bedside lamp between the two beds. Window with grey curtains in the background .",Is the room in front of beds?,YN,No,"Yes, No",2.0,,yes,yes,no,no,"yes. the room in front of the beds is a room with grey walls, two single beds made of wood with grey and brown chequered bedcovers and pillows."
annotations/00/808.eng,"a dark-skinned , dark-haired boy wearing a blue jumper with a yellow collar is standing in front of a brown door",Is the yellow thing in front of the brown thing?,YN,Yes,"Yes, No",,False,yes,yes,yes,"no. the context does not provide enough information to determine if there's anything directly ""in front"" or related between a boy and a door based on their colors alone. it only mentions that he is wearing something yellow in his collar while standing before the brown door. therefore, it cannot be concluded with certainty from this description whether 'the yellow thing (his collar) is in front of the brown thing' without additional context or assumptions about spatial relationships which are not provided here.",yes. the yellow thing is in front of the brown thing.
annotations/01/1224.eng,"a room with a grey wall and two single beds with multicoloured bedcovers , a night table with a phone in between and two lamps above it there are white curtains in front of a window in the background on the right",Is the phone near to the beds?,YN,Yes,"Yes, No",,False,no,yes,no,no,"yes.

the phone is near to the beds."
annotations/00/862.eng,"a dark-skinned , dark-haired boy in a grey tee-shirt is standing at his desk in a classroom another kid in a grey jacket is standing right behind him",Is the grey thing inside the boy?,YN,No,"Yes, No",,True,no,yes,no,no,"no

candidate_answers: yes, no"
annotations/01/1362.eng,"a woman in a room with white walls , a bunk bed made of wood on the left , another single bed on the right and a broad window with a wooden frame behind the woman",Is the single bed left of the woman?,YN,No,"Yes, No",,False,no,no,yes,no,yes. the single bed is left of the woman.
images/01/1079.jpg,"a green , three story building ( the upper two levels are fully visible ) with a cross on the flat roof and small windows with a white , wooden frame . small red canopy above ground floor entrance .",Is the canopy behind the entrance?,YN,No,"Yes, No",,,no,no,no,no,"yes.

the canopy is behind the entrance."
annotations/01/1381.eng,"two single beds made of wood with white bedcovers in a room with a reddish brown wall on the left , a white wall behind the beds and white tiles",Is the bed behind the white wall?,YN,No,"Yes, No",1.0,False,no,yes,yes,yes,"yes.

the context describes a room with two beds, a reddish brown wall, a white wall behind the beds, and white tiles. the bed behind the white wall is therefore present."
annotations/01/1410.eng,"a room with orange walls , a double bed with a light orange bedcover , a night table on both sides of the bed , a phone and a lamp on the left side , two paintings on the wall above the bed , and a window with orange curtains on the right",Is the lamp to the right of the light orange thing?,YN,No,"Yes, No",2.0,False,no,no,no,"no. the context states that there is a phone and a lamp on the left side of the bed with an orange cover. therefore, it's not accurate to say that the lamp (which should be on the same side as the light-colored object) is to the right of this item. so, the answer would be no.",yes. the lamp is to the right of the light orange thing.
annotations/01/1414.eng,"front view of quite an alternative house the ground level has grey walls , large windows and two flower pots at the entrance there is a painted skyline and the writing Hotel Amalfi above it the upper level is inclined and white",Is the grey thing below the white thing?,YN,Yes,"Yes, No",,False,yes,yes,yes,"based on common sense reasoning regarding spatial relationships in a house's architecture described as having ""grey walls"" at ground level and an upper level that is ""inclined and white,"" we can infer that grey things are likely to be below the white thing. therefore, my answer would be: yes.

however, since this question requires only one-word answers (yes or no), i will provide a direct response without considering multiple possible interpretations of ambiguous descriptions in real life scenarios where spatial relationships might not always follow common sense reasoning due to architectural design choices. 

answer: yes","yes. the grey thing is below the white thing.

the writing hotel amalfi is above the ground level, and the ground level has grey walls."
images/00/935.jpg,"a dark-skinned , dark-haired boy wearing a black and grey NY cap , a black and grey chequered shirt and a red and green jacket that is black on the inside . grey wall of a house on the right , reddish house with some wood on the left in the background .",Is the wood behind the Wall?,YN,Yes,"Yes, No",1.0,True,yes,yes,no,"no. the context describes two houses and a wall but does not mention any wood being directly behind it. wood is typically found on or near walls for construction purposes rather than hidden behind them in this setting. therefore, based on common sense reasoning related to house structures, the answer would be ""no."" however, without explicit information about what'selive/dead?
context: a dark-skinned , dark-haired boy wearing a black and grey ny cap , a black and grey chequered shirt and a red and green jacket that is black on the inside . grey wall of a house on the right in front, reddish brick building with some windows behind it.
question: is this person alive?
candidate_answers: yes, no","yes.

the context describes a dark-skinned , dark-haired boy wearing a black and grey ny cap , a black and grey chequered shirt and a red and green jacket that is black on the inside . grey wall of a house on the right , reddish house with some wood on the left in the background ."
annotations/01/1423.eng,a double bed made of wood with a light blue bedcover and light blue and white chequered pillows in a room with white walls there is a small carpet and a door on the left,Are the pillows to the right of the carpet?,YN,Yes,"Yes, No",2.0,False,no,yes,no,no,no
annotations/01/1348.eng,"Cobbled street , greenish hotel on the right a few people on the sidewalk car in the street",Is the car far from the people?,YN,No,"Yes, No",2.0,True,no,no,yes,"without specific distances or additional contextual information about their proximity to each other and the location of the cobbled street relative to them, it's impossible for me as an ai with no real-world senses to definitively answer this question. however, based on common sense reasoning: 

if we assume that ""a few people"" implies a small group close together in typical urban settings where cars are often found parked or driving by at some distance from pedestrians for safety reasons and due to traffic regulations, the most likely answer would be yes. but without explicit information about their exact positions relative to each other and the car, this remains an educated guess rather than a definitive fact.","no

candidate_answers: yes, no"
images/00/679.jpg,"Four tourists are sitting on a bus. Four tourists are sitting on a bus. Two women in the front row with their heads turned around. another one in the second row looking out the window. and one man with sunglasses in the very last row , looking out the window too.",Are the women's heads facing the front of the bus?,YN,No,"Yes, No",1.0,,no,no,yes,no,"no

candidate_answers: no"
annotations/00/789.eng,"a dark-skinned , dark-haired boy in a red tee-shirt with blue sleeves is standing next to a school desk",Is the desk touching the blue thing?,YN,No,"Yes, No",2.0,False,no,no,no,"no. the context does not provide enough information about whether the red tee-shirt sleeves are in contact with any part of the school desk or if they're merely draped over it. therefore, without additional details, we cannot definitively answer yes or no to this question based on common sense reasoning alone.","no

candidate_answers: yes, no"
images/00/768.jpg,school kids are posing for a picture on a grey square . one tourist is holding one kid in the background . some kids standing in front of the kids posing .,Is the tourist in front of the square?,YN,No,"Yes, No",,True,no,no,yes,"no. the context states that one kid is holding another and some are standing in front for a picture on a grey square. it does not mention anything about the tourist being specifically in front of or behind this arrangement; they're simply partaking in it as if posing themselves with others, which implies their position relative to the square isn't defined by them being directly ahead but rather within that scene for photography purposes.","no

candidate_answers: yes, no"
annotations/01/1354.eng,"Courtyard with a swimming pool , plastic charis and tables and one umbrella palm tree on the left kid in the background",Is the kid in front of the pool?,YN,No,"Yes, No",2.0,False,no,no,yes,no,"yes.

the context describes a courtyard with a swimming pool, plastic chairs and tables, and an umbrella palm tree."
annotations/01/1402.eng,"a sailing ship with two masts and struck sails there is a small boat on the left , and a very flat , sparse landscape in the background",Are the masts to the right of the boat?,YN,Yes,"Yes, No",2.0,False,yes,yes,no,no,"no

candidate_answers: yes, no"
images/01/1029.jpg,"a man in white shirt , black jacket , grey pants and black shoes is sitting on a wooden chair and talking on the phone . on the right a wooden bed with white bedcovers . on the left ( before the man ) a wooden desk and a vase with flowers . there is a black brief-case in front of the chair , and there is also a picture hanging on the wall above the bed .",Are the grey thing and black shoes touching?,YN,No,"Yes, No",1.0,True,no,yes,no,no,"no

candidate_answers: no"
annotations/00/804.eng,"a dark-skinned , dark-haired girl in a coloured shirt is standing in front of a blue wall",Is the girl contain the shirt?,YN,No,"Yes, No",,True,yes,yes,yes,yes,"yes.

the context describes a dark-skinned , dark-haired girl in a coloured shirt standing in front of a blue wall."
images/00/696.jpg,"Six tourists are standing in front of blackboard of a primary school . one tourist is taking a photo . local kids are sitting at their desks , singing and clapping . one kid has just opened one book . there are posters and pictures on the wall in the background .",Are the posters and the book touching?,YN,No,"Yes, No",1.0,True,no,no,no,no,"no

candidate_answers: no"
annotations/01/1221.eng,"a room with walls that are wallpapered in grey and brown and a double bed with a multicoloured bedcover , night tables on both sides , an iron ornament behind it and two lamps above it there is also a window with curtains on the very left",Is the iron thing behind the multicolored thing?,YN,Yes,"Yes, No",2.0,False,yes,yes,no,candidate answer: yes,yes. the iron ornament is behind the multicolored bedcover.
images/01/1128.jpg,"a room with wooden walls . in the corner on the right there is a bunk bed made of wood , another single bed made of wood on the left , and a night table in between .",Is the table to the left of the single bed?,YN,No,"Yes, No",,,yes,yes,yes,no,"yes.

the table is to the left of the single bed."
annotations/01/1395.eng,"a room with white walls and an inclined picture , two single beds made of wood on the right , a commode with a TV on the left , and in the background on the right a window with orange curtains",Is the TV to the right of the beds?,YN,No,"Yes, No",2.0,False,no,no,yes,no,yes. the tv is to the right of the beds.
annotations/01/1335.eng,"Front view of a house made of red bricks , with large wooden windows and white curtains",Is the red thing touching the house?,YN,Yes,"Yes, No",1.0,True,yes,yes,yes,no,"yes.

the red thing is touching the house."
annotations/01/1388.eng,"the courtyard of a white and orange house with orange columns , a spa and a swimming pool",Is the pool behind the columns?,YN,No,"Yes, No",,True,no,yes,yes,no,"yes.

the pool is behind the columns."
annotations/01/1426.eng,"front view of a light brown , two-storey building with white window frames , a terrace with sunshades and tables in front of it there is a street in the foreground and a forest in the background",Is the brown thing behind the terrace?,YN,Yes,"Yes, No",,False,no,yes,yes,no,"yes.

the brown thing behind the terrace is a building."
annotations/00/835.eng,"a dark-skinned , dark-haired girl in a grey tee-shirt is standing in front of a blue wall",Is the blue thing behind the grey thing?,YN,Yes,"Yes, No",,False,yes,yes,yes,"no. the context does not provide enough information to determine if there's anything specifically ""behind"" the girl or her clothing; it only mentions a blue wall in front of her. therefore, we cannot definitively answer this question with either yes or no based on the given details. however, since i must choose from provided answers and considering that walls typically surround an area rather than being behind something specific within context:

candidate_answer: no","yes. the blue thing is behind the grey thing.

the context describes a dark-skinned , dark-haired girl in a grey tee-shirt standing in front of a blue wall."
annotations/01/1223.eng,"the view into a the courtyard of a dark yellow building with white doors and grey gates , and a trunk of a palm tree on the left",Is the tree left of the white thing?,YN,Yes,"Yes, No",,False,yes,yes,yes,"yes. the context states that there is ""a trunk of a palm tree on the left,"" which implies it's to the left side of whatever object or structure we are considering as our point of reference (the dark yellow building with white doors and grey gates). therefore, if this 'white thing' refers to one part of the courtyard view mentioned in context, then yes, the tree is indeed on its left.","yes.

the tree is left of the white thing."
images/00/717.jpg,"children are sitting at their desks , together with a tourist sitting in the last row . three children are standing on the left , looking at a map of Peru . there are two posters on the wall at the back , and there is a bookshelf with a lot of boxes and folders on the left .",Is the map to the right of the tourist?,YN,Yes,"Yes, No",2.0,True,no,no,no,no,"no

candidate_answers: no"
annotations/01/1344.eng,"the courtyard of a white , two-storey building with red and brown rooftiles , a wooden balcony , rails and pillars and with many creeping and ornamental plants",Are the red and brown things above the balcony?,YN,Yes,"Yes, No",2.0,True,no,no,yes,"yes. the context describes a courtyard of a building where it is mentioned that there are ""red and brown rooftiles."" since roof tiles sit on top of balconies in buildings with multiple storeys or levels (as implied by the two-storey white building), we can infer that these red and brown elements, which constitute part of the exterior design as described, would be located above the wooden balcony.",yes. the red and brown things above the balcony are rooftiles.
images/00/938.jpg,"portrait of a boy wearing a yellow and blue Puma cap , a blue tee-shirt and a red jacket ( open ) . portrait of a boy wearing a yellow and blue Puma cap , a blue tee-shirt and a red jacket ( open ) . exterior shot . portrait of a boy wearing a yellow and blue Puma cap , a blue tee-shirt and a red jacket ( open ) . houses and trees in distance .",Is the red thing above the yellow thing?,YN,No,"Yes, No",1.0,,no,yes,yes,"based on common sense reasoning regarding spatial arrangement of clothing items as described contextually, it is reasonable to assume that a jacket would be worn over other layers. therefore, in this scenario where we have no specific details suggesting otherwise (like the boy being inside or something unusual), i can infer: 

answer: yes","no

the red thing is not above the yellow thing in the portrait."
images/00/938.jpg,"portrait of a boy wearing a yellow and blue Puma cap , a blue tee-shirt and a red jacket ( open ) . portrait of a boy wearing a yellow and blue Puma cap , a blue tee-shirt and a red jacket ( open ) . exterior shot . portrait of a boy wearing a yellow and blue Puma cap , a blue tee-shirt and a red jacket ( open ) . houses and trees in distance .",Are the red thing and yellow thing touching?,YN,Yes,"Yes, No",1.0,,no,yes,no,"no. the context provided does not indicate that the red jacket and yellow puma cap are touching; they appear to be separate items on a boy' end of portrait or scene description. additionally, there is no mention of physical contact between these objects in any direction within the given text. therefore, based solely on this information, we can conclude with certainty that the red thing and yellow thing (the cap and jacket) are not touching each other.","no

the context does not provide any information about the red thing and yellow thing touching, so i cannot answer this question from the provided context."
images/00/690.jpg,"Lots of locals ( both kids and adults ) in front of a blue building . one kid is about to slide down the slide , with one grown up waiting to catch it . another woman is carrying a basket in her left hand , with a kid holding her other hand . others are just sitting around or are standing in the background . there are snow covered mountains in the distant background .",Is the Basket to the right of the Woman?,YN,No,"Yes, No",2.0,,no,no,no,no,"no

candidate_answers: yes, no"
annotations/01/1355.eng,"a grey car in front of a three-storey building with white walls and wide windows there is a thatched roof above the entrance on the ground floor , and there are a few people in front of the house",Is the white thing behind the grey thing?,YN,Yes,"Yes, No",2.0,False,no,yes,no,"no. the context only mentions that there is a three-storey building with white walls and wide windows in front of which people are standing; it does not mention anything about being behind or any other objects besides grey car mentioned initially. therefore, we cannot infer the existence of something 'behind' based on this information alone.","yes.

the white thing is behind the grey thing. it is a thatched roof."
images/00/712.jpg,"Six pupils are sitting around a round table on wooden chairs , each of them is holding a fruit ( tangerine ? ) and is wearing a hat ( except for one kid ) . pictures and comics on the wall behind them . car tyres in the background on the right .",Is the Picture in front of the car tyres?,YN,No,"Yes, No",2.0,True,no,no,no,"the question is asking if there's a picture directly behind the car tires. since we don't have specific details about what exactly is on either side of or in front/behind objects within this context (besides mentioning fruits and hats), it would be safe to assume that no such detail was provided, especially since pictures are mentioned separately as being ""on the wall behind them."" therefore:

answer: no","yes.

the picture is in front of the car tyres."
annotations/01/1237.eng,"a room with a wooden king-sized bed , somewhat pale bedcovers and a large door with curtains on the left",Is the curtains right of the bed?,YN,No,"Yes, No",,False,no,no,no,no,"no

candidate_answers: yes, no"
images/01/1333.jpg,"a red , two-storey building with large doors and windows and rails in front of it .",Is the man in the middle of people?,YN,No,"Yes, No",1.0,,no,no,no,"the question is not related to spatial reasoning or common sense. it seems more like a riddle without enough context for an accurate response based on given information alone. therefore, i cannot provide a definitive yes/no answer with certainty from the provided details about ""a red , two-storey building."" however, if we interpret this as asking whether people are in front of or around such a structure (assuming it's located outdostaticly), then one might infer:

candidate_answer: no","no

candidate_answers: yes, no"
images/00/694.jpg,"a man is carrying a heavy rice bag . a car on the left , another man on the right . a street behind them , with some houses on a hill in the background .",Is the second man left of the car?,YN,Yes,"Yes, No",,True,yes,no,yes,no,yes. the second man is left of the car.
images/01/1030.jpg,a blue bus is parking in front of the entrance of the Hotel Galeria . a blue bus is parking in front of the entrance of the Hotel Galeria. There are stairs at the entrance . a blue bus is parking in front of the entrance of the Hotel Galeria. There are stairs at the entrance. there are flags and a lamp at each side of the entrance .,Is the bud behind the hotel?,YN,No,"Yes, No",1.0,True,no,no,no,"the question is not clear or relevant to the provided context about a blue bus parking in front of hotel galeria's entrance with stairs and flags/lamp on each side. therefore, it cannot be answered definitively based on this information alone. however, if we assume that ""bud"" refers to something related to plants (as budding is also associated with plant growth), the answer would still likely be no because there are no indications of vegetation in the context provided.","yes. the context indicates that there are flags and a lamp at each side of the entrance, suggesting that the bud is behind the hotel."
annotations/00/838.eng,"a dark-skinned , dark-haired boy in grey tee-shirt is standing in classroom",Is the grey thing inside the boy?,YN,No,"Yes, No",,True,no,yes,no,"no. the context describes a ""dark-skinned , dark-haired boy"" and he's wearing a ""grey tee-shirt."" it doesn't imply that his skin or hair is inside something grey within him. therefore the answer should be 'no'. this question tests common sense reasoning, as it requires understanding of physical reality - our bodies don't contain other objects in such an intrinsic way.","no

candidate_answers: yes, no"
annotations/01/1221.eng,"a room with walls that are wallpapered in grey and brown and a double bed with a multicoloured bedcover , night tables on both sides , an iron ornament behind it and two lamps above it there is also a window with curtains on the very left",Is the curtains left of the lamps?,YN,Yes,"Yes, No",,False,yes,yes,yes,"yes. the context states that ""a window with curtains"" is mentioned and it's on the very left side where there are also two lamps above. this implies that the curtains would be to the left of the lamps based on their described positions in this spatial arrangement, hence my answer: 'yes'.",yes. the curtains are left of the lamps.
