Context_id,Story,Question,Question_Type,Answer,Candidate_Answers,Steps_of_Reasoning,Is_Commonsense_Question,ollama/openchat,ollama/llama3,ollama/mistral,ollama/phi3:mini,ollama/gemma:2b
annotations/00/812.eng,"a dark-skinned , dark-haired girl in a grey T-Shirt is standing in a classroom a wall made of red bricks in the background",Is the grey thing outside of the classroom,YN,No,"Yes, No",2.0,False,no,yes,no,no,"yes.

the grey thing outside of the classroom is a wall made of red bricks."
images/00/679.jpg,"Four tourists are sitting on a bus. Four tourists are sitting on a bus. Two women in the front row with their heads turned around. another one in the second row looking out the window. and one man with sunglasses in the very last row , looking out the window too.",Is the man behind the bus?,YN,No,"Yes, No",1.0,,no,no,no,no,"no

candidate_answers: yes, no"
images/00/958.jpg,"a dark-skinned , dark-haired girl wearing a black hat , a white cardigan , a green vest and a golden necklace . two houses in the background , one with a grey roof , the other one with a light brown roof . short grass and some large stones in the background .",Is the grey thing below the brown thing?,YN,No,"Yes, No",1.0,True,no,yes,yes,"the context provided does not give enough information about specific objects being gray or brown. therefore, without additional details on what exactly is referred to as ""the grey thing"" and ""the brown thing,"" it's impossible to accurately answer the question based solely on common sense reasoning from this text snippet alone. hence:

answer: no",yes. the grey thing is below the brown thing.
images/00/692.jpg,"there are two social workers in the foreground . one wearing a red pullover and brown pants is bending over to access the blue paint . the other one in a red tee-shirt and black jeans is watching her . at the back of the room there is another worker wearing a white tee-shirt and blue jeans , acutally painting . there are many newspapers on the ground to protect the kindergarten floor . all three workers are wearing a mask .",Is the white thing behind the paint?,YN,Yes,"Yes, No",,True,no,yes,no,no,yes. the white thing behind the paint is a whiteboard.
images/01/1090.jpg,"exterior view of a three story building . entrance and arched windows on ground floor , a coop with a rail , a balcony with several arches and columns on the second floor , balcony with columns on the third floor .",Is the coop below the balconies?,YN,Yes,"Yes, No",,,yes,yes,no,"yes. the common sense reasoning suggests that since there are multiple floors and each has a distinctive feature (entrance with arched windows on ground floor, coop with rail), it is reasonable to assume that the coop would be located below the balconies which occupy higher levels of the building.","no

the context does not provide any information about the coop being below the balconies."
images/00/971.jpg,"a dark-haired , dark-skinned boy wearing a black cap ( backwards ) and a red and green tee-shirt underneath a light blue anorak . a dark-haired , dark-skinned boy wearing a black cap ( backwards ) and a red and green tee-shirt underneath a light blue anorak. Short grass in the background .",Are the red thing and blue thing touching?,YN,Yes,"Yes, No",1.0,,no,yes,no,"without additional context or visual cues indicating proximity between objects of different colors on a person's body (like accessories), it is not possible to definitively determine if they are touching. therefore, based solely on common sense reasoning and the information provided in the question, my answer would be:

no","no

the context does not provide any information about the red and blue things touching, so i cannot answer this question from the provided context."
images/00/738.jpg,Excited kids are standing at their desks in a classroom . some of them seem to be very happy and are laughing . there are pictures of trees on the wall at the back . two girls have an open book on their desk .,Is the desks inside the classroom?,YN,Yes,"Yes, No",,True,yes,yes,yes,yes,"no

candidate_answers: no"
images/00/949.jpg,"a dark-skinned , dark-haired girl wearing a black hat , a white cardigan and a red poncho . a dark-skinned , dark-haired girl wearing a black hat , a white cardigan and a red poncho. exterior shot . short grass and some garbage in the background .",Are the red thing and black thing touching?,YN,No,"Yes, No",1.0,True,no,yes,no,"without additional context or visual cues indicating proximity between the two items (black hat and red poncho), it is not possible to definitively determine if they are in contact. therefore, based on common sense reasoning without further information, my answer would be: 

no","no

the context does not provide any information about the red thing and black thing touching, so i cannot answer this question from the provided context."
annotations/00/837.eng,"a dark-skinned , dark-haired boy in a blue-and-white striped jumper with a sleeveless pullover is standing in front of a red brick wall and a blue wall",Is the red thing and the blue behind white thing?,YN,Yes,"Yes, No",,False,no,yes,no,"the question seems to be asking if there are two things that match with each other in color. however, it's not clear which objects or colors we should compare because of ambiguous phrasing like ""behind white thing."" assuming the boy and his clothing (dark-skinned/haired) is being considered as one entity:

candidate_answer: no",yes. the red thing and the blue thing are white.
annotations/00/836.eng,"a dark-skinned , dark-haired boy in a black pullover is standing in front of a blue wall",Is the girl touching the black thing?,YN,Yes,"Yes, No",1.0,True,no,no,no,"the question cannot be answered with either ""yes"" or ""no"" based on the provided context. there is no mention of a 'girl' in the original scenario; therefore, it does not provide enough information to determine if she is touching anything black. 

candidate_answer: no","no

candidate_answers: yes, no"
images/00/704.jpg,"Pupils are sitting at their wooden desks in an open air classroom . two of them raising their hands , others smiling . three are wearing a green hat . red brick wall and windows in the background .",Is the hat behind the windows?,YN,No,"Yes, No",,True,no,no,no,"no. the context does not provide enough information to determine if the hats are directly behind the windows or even near them; it only states that three students are wearing a green hat without specifying their location in relation to the window'static structure'. therefore, based on common sense reasoning and spatial awareness within this limited context, i cannot definitively answer yes.",yes. the hat is behind the windows.
images/00/736.jpg,"tourists are standing in front of the blackboard in a classroom . all the kids are sitting at their desks , some of them turned around to look at the camera . there is a clock above the blackboard , and also the letters Dios es amor between the clock and the blackboard , and higiene es salud on the side wall below the windows .",Is the clock below the school?,YN,No,"Yes, No",1.0,,no,no,no,no,"no

the context does not provide any information about the clock being below the school."
annotations/01/1358.eng,"a multi-storey frame house on the left , a snowcovered mountain in the background on the right behind a couple of trees , and in the foreground a wall decorated with flowers , a garden and a lawn",Is the garden in front of the trees?,YN,Yes,"Yes, No",,False,no,yes,yes,yes,"yes.

the garden is in front of the trees."
annotations/00/791.eng,"a dark-haired , dark-skinned girl is sitting on a red couch , wearing a pink pullover with a little bear",Is the pink thing inside the girl?,YN,No,"Yes, No",,True,no,yes,no,"yes. the context states that she is ""wearing"" it, which implies that the item (the pink pullover with a little bear) is on her body and inside of her clothing layers. therefore, we can conclude that yes, the pink thing is indeed inside the girl as part of what she'ries wearing.","yes. the context describes a pink thing inside the girl, so it must be inside her."
annotations/01/1342.eng,"a narrow , long courtyard of a brown house with wooden doors , white door frames and many pictures on the walls there are many plants , wooden chairs and flower pots",Are the pictures above the chairs?,YN,Yes,"Yes, No",2.0,True,no,no,yes,"no. the context does not provide enough information to determine a specific vertical arrangement of items in the courtyard; therefore, we cannot definitively say that the pictures are above the chairs based solely on this description.","no

the context does not provide any information about the position of the pictures relative to the chairs, so i cannot answer this question from the provided context."
images/00/737.jpg,many people are working on the bare brickwork of a house or are watching the workers from below . many wires are sticking out of the bare brickwork . one person is climbing up a ladder . many pallets are lying piled up in front of the house .,Are the brickwork touching wires?,YN,Yes,"Yes, No",1.0,True,yes,no,no,"based on common sense reasoning and spatial understanding, without specific details about wire placement or proximity to the bare brickwork in question, it is safest to assume that not all wires are touching the brickwork. therefore, my answer would be candidate_answers: no. however, if there were explicit information indicating otherwise, then yes, they could potentially be touching.","no

the passage does not specify whether the brickwork is touching the wires, so i cannot answer this question from the provided context."
annotations/01/1516.eng,a white ship at the sea a blue sky in the background,Is the blue thing behind the sea?,YN,Yes,"Yes, No",,False,yes,yes,no,candidate answer: yes,"yes.

the blue sky is behind the sea in the image."
images/01/1098.jpg,"a man in a black jacket and brown pants shovelling snow from the entrance ( with a red shovel ) . behind him a white door , a large window .",Is the shovel behind the entrance?,YN,No,"Yes, No",,,no,yes,yes,"yes. the context states that there is snow being shoveled at the entrance with a red shovel, which implies it's located behind or in front of the entrance for this activity to take place effectively. therefore, we can infer 'yes', the shovel (red one) is indeed associated with the entrance area as per common sense reasoning and spatial understanding.","yes.

the shovel is behind the entrance."
images/01/1060.jpg,"behind it a bar with chairs and two people , and a bench with one person lying on it . behind it a bar with chairs and two people , and a bench with one person lying on it . Upper level with doors and a blue rail .",Is the rail over the chairs?,YN,Yes,"Yes, No",,True,no,no,no,no,"no

candidate_answers: yes, no"
annotations/01/1361.eng,"a white house with two large windows with wooden frames , two wooden pillars at the terrace with wooden benches and a wooden table there are mountains in the background on the right",Are the benches far from the terrace?,YN,No,"Yes, No",1.0,True,no,no,no,no,"no

candidate_answers: yes, no"
annotations/01/1349.eng,Courtyard with bushes buildings with wooden poles and wooden windows are to the left and right,Is the building right of the courtyard?,YN,Yes,"Yes, No",,False,yes,yes,yes,no,"yes.

the building is to the left of the courtyard."
images/00/955.jpg,"a dark-haired , dark-skinned girl wearing a dark green hat , a grey pullover with blue sleeves and a light blue and yellow necklace . a grey brick wall and short grass in the background .",Are the yellow thing and blue thing touching?,YN,Yes,"Yes, No",1.0,True,no,no,no,"without additional context or visual cues indicating that they are part of an accessory (like a bracelet), i would infer with common sense reasoning that it is unlikely for only one yellow and blue object to be touching. therefore, my answer based on the information provided in this scenario: 

no","no

candidate_answers: yes, no"
annotations/01/1419.eng,"a room with white walls , a blue and white bunk bed on the right and another single bed in front of a broad window with brown curtains",Is the brown bed right of the other bed?,YN,Yes,"Yes, No",,False,no,no,yes,"no. the context mentions ""another single bed"" which is not specified to be on a different side than the bunk bed; it's simply another bed in front of the window with brown curtains without specifying its position relative to other furniture or indicating that there are multiple sides for comparison within this room setup as implied by your question. therefore, we cannot definitively answer yes based solely on provided context and common sense reasoning tasks; hence 'no'.","yes.

the brown bed is right of the other bed."
images/01/1127.jpg,a white house with a thatched roof and a garden with a lot of vegetation behind a grey wall .,Is the garden in front of house?,YN,Yes,"Yes, No",,,no,no,no,no,"yes.

the context describes a white house with a thatched roof and a garden with a lot of vegetation behind a grey wall."
annotations/00/845.eng,"a dark-skinned , dark-haired girl in a white shirt and black pants with black suspenders is sitting at her desk in a classroom some kids in the background are sitting at their desks",Is the white thing close to the desk?,YN,Yes,"Yes, No",,True,yes,yes,yes,"to provide an accurate response, i would need more specific information about what ""white thing"" is being referred to in this context. without additional details or a clear subject for reference within the scene described, it's impossible to definitively answer whether something white near the girl' end of her desk based on common sense reasoning alone.","no

candidate_answers: yes, no"
annotations/00/813.eng,"a dark-skinned , dark-haired boy in dark vest is standing in front of a wall made of rocks",Is the vest in front of the rocks?,YN,Yes,"Yes, No",,False,yes,yes,yes,yes,"yes.

the vest is in front of the rocks."
images/00/754.jpg,Tourists are standing on a wet sidewalk and are carrying bags of food . people are wearing rain coats and jackets . a house with brick walls and two garage doors behind them .,Are people touching the raincoats?,YN,Yes,"Yes, No",1.0,,no,yes,no,"based on common sense reasoning, it is likely that tourists are wearing rain coats and jackets to protect themselves from getting wet in a rainy environment. however, without specific information about their actions or interactions with each other's clothing, the safest answer would be: 

no","no

candidate_answers: yes, no"
images/01/1122.jpg,"a room with white and orange walls and a brown ornament . there is a double bed made of iron , light brown pillows , white bedcover and towels . a night table with a bedside lamp and a phone on the right . and a window with white curtains on the very right .",Is the brown thing below the orange thing?,YN,No,"Yes, No",,,no,no,no,"without specific spatial information about their positions in relation to each other within the room's description provided, it is impossible for me as a language model ai developed by microsoft with no visual perception capabilities or memory of past interactions beyond this single session. therefore, i cannot provide an accurate answer based on common sense reasoning tasks without additional contextual information about their relative positions in the described scene.

however, if we assume that ""brown thing"" refers to either the iron bed (which is light brown) and pillows or just one of them being brown, while ""orange thing"" could refer to any orange-colored object within this context such as a decoration on the wall: 

question: is there an orange item in the room? yes.
context provided does not specify if all walls are only white and orange or just one of them is painted with these colors, but it's safe to assume that at least some part of the room has been described as having orange coloration since you asked about ""orange thing"". 

question: is there a brown item in the room? yes.
the bed (made from iron and light brown pillows) is clearly mentioned, so we can confirm its presence within this context. the towels are also specified as white but could potentially be of any color including brown; however, without explicit information about their colors, i cannot definitively answer that they're brown based on the provided description alone.

question: is there a bed in the room? yes. 
the double iron bed is explicitly mentioned within this context and thus we can confirm its presence.

based on these answers to individual questions about color-coded items, i cannot accurately answer whether ""the brown thing"" (presumably referring to one of the previously identified brown objects) is below ""the orange thing"". this question requires specific spatial information which has not been provided in this context and thus would be considered unanswerable based on common sense reasoning tasks without additional details.

candidate_answer: no",yes. the brown thing is below the orange thing.
annotations/00/824.eng,"a dark-skinned , dark-haired boy wearing a colourful shirt and a sleeveless pullover is standing in front of a blue wall",Is the blue thing in front of the boy?,YN,No,"Yes, No",1.0,False,no,yes,yes,"yes. the context states that there's a ""blue wall"" and it specifies its color as well. therefore, based on common sense reasoning, we can infer that what is in front of the boy (the blue thing) refers to this blue wall. so, yes, the 'blue thing' or object mentioned here is indeed in front of the boy - specifically referring to a part of his surrthy environment which he cannot see through as walls are not transparent objects and they block our view when we stand directly in front of them.",yes. the blue thing is in front of the boy.
annotations/01/1230.eng,"a courtyard with tables , wooden chairs , a fountain on the right , several arches and columns and a bar there are potted plants and green rails on the balcony of the second floor",Is the tables right of the fountain?,YN,No,"Yes, No",,False,no,no,yes,"based on common spatial arrangements in courtyards where water features like fountains are often placed as focal points and surrounded by seating areas such as tables for convenience, it is reasonable to assume that the tables could be right of the fountain. however, without explicit information about their exact positions within this context, we cannot definitively answer with certainty. therefore:

candidate_answer: no",yes. the tables are right of the fountain.
annotations/00/872.eng,"a dark-skinned , dark-haired boy in a blue jumper with a yellow zip and a light blue nametag is standing in a classroom some kids are standing behind him",Is the blue thing touching the boy?,YN,Yes,"Yes, No",1.0,True,yes,yes,yes,"no. the context only mentions that there's a light blue nametag on the boy and nothing about it being in contact with his skin or clothing. it is common sense to assume personal items like name tags are worn rather than touching directly against one’ end of them without any specific mention, thus we can conclude no based on provided context.","no

candidate_answers: yes, no"
annotations/00/794.eng,"a dark-skinned , dark-haired girl wearing a yellow blouse with a blue collar handprints on the wall behind her",Is the yellow thing below the blue thing?,YN,Yes,"Yes, No",,True,no,yes,yes,"without additional context or visual representation of their positions relative to each other, it's impossible for me as an ai with only text-based capabilities and common sense reasoning skills to definitively determine whether ""the yellow thing is below the blue thing."" therefore, based on this limitation, my answer would be:

no.",yes. the yellow thing is below the blue thing.
images/00/683.jpg,"Three women are sitting on a wooden bench in front of an about one metre high , red brick wall . they are all wearing skirts and jumpers with gilets . two of them are wearing a hat too. one man is standing behind the wall. a wooden door on the left is being held open by a red brick .",Is the man behind the hat?,YN,Yes,"Yes, No",1.0,,no,no,no,no,"yes.

the context describes a man standing behind a hat, so he must be the man behind the hat."
annotations/00/875.eng,"a dark-skinned girl with black , ear-long hair in a green pullover and sleeveless brownish jumper is standing in a classroom behind her a boy with a blue cap , white tee-shirt and red pants a blackboard and more kids sitting at their desk in the background",Is the brown thing behind the desks?,YN,No,"Yes, No",2.0,False,no,yes,yes,"the context does not provide enough information about ""the brown thing"" to definitively determine its presence or absence. therefore, based on given details only, i cannot confirm if it is behind the desks without making assumptions beyond common sense reasoning tasks and spatial understanding. 

answer: cannot be determined from the provided context (no).",yes. the brown thing behind the desks is a blackboard.
annotations/01/1522.eng,"the end of a glacier , with broken off ice floes that are floating in front of it snowcovered mountains in the background",Is the glacier in front of the mountain?,YN,Yes,"Yes, No",2.0,False,no,yes,yes,"no. the context describes a scene where there is an end of a glacier with broken off ice floes floating in front of it and snow-covered mountains in the background. this means that the mountain cannot be behind the glacier as stated; therefore, based on common sense reasoning about spatial relationships, we can conclude:

the answer to whether the glacier is in front of the mountain (given this context) would logically be no.","yes.

the glacier is in front of the mountains, with broken off ice floes floating in front of it."
annotations/01/1207.eng,"view of a brown house with grey and brown rooftiles there is a meadow with flowers in front of the house and a couple of trees behind it , and a canyon in the background",Is the brown thing behind the trees?,YN,No,"Yes, No",2.0,False,no,yes,yes,"no. the context describes that there is a meadow with flowers in front of the house, and some trees are located behind it. therefore, if we assume ""brown thing"" refers to something on or near the ground level (like soil), then no brown things would be directly behind the trees as they're positioned between the canyon background and this area.",yes. the brown thing behind the trees is a canyon.
images/00/971.jpg,"a dark-haired , dark-skinned boy wearing a black cap ( backwards ) and a red and green tee-shirt underneath a light blue anorak . a dark-haired , dark-skinned boy wearing a black cap ( backwards ) and a red and green tee-shirt underneath a light blue anorak. Short grass in the background .",Is the red thing above the blue thing?,YN,No,"Yes, No",1.0,True,no,yes,no,"without additional context or visual cues indicating that one item is directly on top of another within a specific arrangement (like stacking objects), it's impossible to definitively determine their relative positions based solely on this description. therefore, the answer would be ""no."" however, if there were more details provided about how these items are positioned in relation to each other or additional visual information available, we could give a different response.","yes.

the red thing is above the blue thing in the picture."
images/00/737.jpg,many people are working on the bare brickwork of a house or are watching the workers from below . many wires are sticking out of the bare brickwork . one person is climbing up a ladder . many pallets are lying piled up in front of the house .,Are the brickwork touching wires?,YN,Yes,"Yes, No",1.0,,yes,no,no,"based on common sense reasoning and spatial understanding, without specific details about wire placement or proximity to bare brickwork in this context, it's safest to assume that not all wires are touching. therefore, my answer is ""no."" however, please note there could be exceptions if the scenario was different with explicit information provided.","no

the passage does not provide any information about the brickwork touching the wires, so i cannot answer this question from the provided context."
images/00/728.jpg,"Close-up photo of a building with a blue front , red doors , brown bricks below the windows and the wires that stick out from the roof . a few pupils are in front of the building .",Is the wires below the door?,YN,No,"Yes, No",,True,no,no,no,no,"yes.

the wires are below the door."
annotations/01/1401.eng,"children in a swimming pool in a garden that is surrounded by a green wall there are two canvas chairs , white tables and chairs , a clothesline and a sunshade in the shade behind the pool there is also the corner of a green house on the left there are trees in the background",Is the pool to the right of the house?,YN,Yes,"Yes, No",2.0,False,no,no,no,no,"no

candidate_answers: yes, no"
images/00/684.jpg,"photo of a classroom with some kids sitting at their desks , others standing at their desks , waving into the camera , laughing. two kids are eating their lunch in the foreground . there is a wooden wall with pictures of two comic figures in the background .",Are the kids in the middle of the foreground?,YN,Yes,"Yes, No",,True,no,yes,yes,no,"no

candidate_answers: no"
images/00/961.jpg,"a dark-skinned boy wearing a white cap , a green pullover and a red vest .",Is the red thing above the green thing?,YN,No,"Yes, No",1.0,True,yes,yes,yes,"yes. the context states that there is ""a dark-skinned boy wearing a white cap , a green pullover and a red vest."" since vests are worn over shirts (or in this case, pullovers), the red item (vest) would be above the green item (pullover).","yes.

the red thing is above the green thing."
