Context_id,Story,Question,Question_Type,Answer,Candidate_Answers,Steps_of_Reasoning,Is_Commonsense_Question,ollama/openchat,ollama/llama3,ollama/mistral,ollama/phi3:mini,ollama/gemma:2b
annotations/00/849.eng,"a dark-skinned , dark-haired girl in a white vest and black pants is standing next to a desk the lower half of a bottle of Kola Real is standing on a desk next to her a red brick wall in the background",Is the black thing far from the desk?,YN,No,"Yes, No",2.0,False,no,yes,no,"without more context or specific measurements of distance, it's impossible for me as an ai to definitively determine whether ""the black thing"" (presumably a bottle with its lower half on the desk and upper part possibly in her hand) is far from the desk. however, based solely on common sense reasoning:

answer: no",yes. the black thing is far from the desk.
images/01/1121.jpg,View of the courtyard of a brown house with white window frames and an iron rail and two angel statues . there are canes in the foreground on the left . a man is sitting at a table on the balcony .,Are the angels inside the courtyard?,YN,Yes,"Yes, No",,,no,no,no,no,"no

candidate_answers: yes, no"
images/00/967.jpg,"portrait of a coloured , dark-haired boy with a bit washed-out green hat , white tee-shirt and a claret vest pullover , in front of a branch of a conifer .",Are the green thing and white thing touching?,YN,No,"Yes, No",1.0,,no,yes,yes,"based on common sense reasoning regarding clothing placement when worn by an individual, it is reasonable to assume that different pieces of clothing are not in direct contact with each other. therefore, my response would be:

no","no

candidate_answers: yes, no"
images/00/737.jpg,many people are working on the bare brickwork of a house or are watching the workers from below . many wires are sticking out of the bare brickwork . one person is climbing up a ladder . many pallets are lying piled up in front of the house .,Is the house in front of the pallets?,YN,No,"Yes, No",,True,yes,yes,yes,"yes. the context implies that the bare brickwork and wires being worked on are part of or near the house which is also where people (including someone climbing a ladder) seem to be working around. therefore, it's reasonable to conclude that the work-in-progress house stands in front of the pallets piled up as workers prepare for construction activities.","no

the context does not provide any information about the house or the pallets, so i cannot answer this question from the provided context."
annotations/00/817.eng,"a dark-skinned , dark-haired girl in a blue-and-yellow jumper is sitting outside boulders in the background",Is the blue and yellow thing behind the boulders?,YN,No,"Yes, No",2.0,False,yes,yes,yes,candidate answer: yes,yes. the blue and yellow thing behind the boulders is a blue and yellow jumper.
images/01/1314.jpg,"a white bungalow with a huge , brown hill behind it and trees , a sunshade , plastic chairs , a plastic table and canvas chairs in front of it . a white bungalow with a huge , brown hill behind it and trees , a sunshade , plastic chairs , a plastic table and canvas chairs in front of it .In the foreground one can also see a part of a swimming pool .",Is the hill in front of the pool?,YN,Yes,"Yes, No",,True,no,no,no,no,"yes.

the hill is in front of the swimming pool."
annotations/01/1237.eng,"a room with a wooden king-sized bed , somewhat pale bedcovers and a large door with curtains on the left",Are the pale things to the left of the door?,YN,No,"Yes, No",2.0,False,yes,yes,yes,"yes. the context mentions ""pale bedcovers"" which are associated with a wooden king-sized bed in the room and since there's no other information suggesting they aren't to the left of the door (with curtains on that side), we can reasonably conclude yes, pale things like bedcovers could be considered as being to the left of the door.","yes.

the pale things to the left of the door are bedcovers."
annotations/01/1377.eng,"front view of a light green house with a grey garage on the right , a white car in front of it and a round front with orange ornamental strips",Is the white thing behind the green thing?,YN,No,"Yes, No",1.0,False,yes,yes,no,"no. the context provided only mentions that there is a ""white car in front of it,"" which implies that the white object (car) is not behind but rather ahead or to the side relative to the green house'sem positioning within this description. there is no mention of anything being directly behind the light green house, hence we can conclude with common sense reasoning and spatial understanding from the context given: no, there isn't a white thing (car) behind the green one in the provided viewpoint scenario.",yes. the white thing behind the green thing is the car.
images/01/1116.jpg,"a room with beige walls . two single beds with a white bedcover , a pillow and a lamp each . there is a mirror on the left , between the beds and on the left there is a a night table . and in the background on the right there is a window with white curtains .",Is the mirror behind the beds?,YN,No,"Yes, No",,,no,no,no,no,"yes.

the mirror is behind the beds."
annotations/00/786.eng,"a dark-skinned , dark-haired girl wearing a white tee-shirt with pink edges and blue pants is kneeing on the ground",Is the pink thing far from a white thing?,YN,No,"Yes, No",1.0,False,no,yes,yes,"to provide an accurate response to this question, i would need more context or specific details about the spatial relationship between the pink and white items. as it stands with only the given information that a girl is wearing clothing of these colors while kneeling on the ground, there's no clear indication whether one item (pink) is far from another (white). therefore:

answer: no","yes. the pink thing is far from a white thing.

the context describes a dark-skinned, dark-haired girl wearing a white tee-shirt with pink edges and blue pants."
images/00/737.jpg,many people are working on the bare brickwork of a house or are watching the workers from below . many wires are sticking out of the bare brickwork . one person is climbing up a ladder . many pallets are lying piled up in front of the house .,Is the ladder touching the house?,YN,Yes,"Yes, No",1.0,,no,yes,yes,"to provide an accurate response to this question based on common sense reasoning and spatial understanding, i would need more specific details about the position of the ladder. however, since these are not provided in your context description, it's impossible for me to definitively answer yes or no without making assumptions that may not be correct. 

in real-life situations like this one, a person might infer from visual cues whether the ladder is touching the house or not but as an ai i can only provide answers based on given information which in your case does not specify if the ladder is indeed touching the house. therefore my answer would be:

candidate_answer: no","no

the context does not provide any information about the ladder's position or touching the house, so i cannot answer this question from the provided context."
annotations/01/1355.eng,"a grey car in front of a three-storey building with white walls and wide windows there is a thatched roof above the entrance on the ground floor , and there are a few people in front of the house",Is the white thing in front of the grey thing?,YN,No,"Yes, No",,False,yes,yes,yes,"no. the context describes only one ""white"" object (the three-storey building with white walls and wide windows), which is not directly mentioned as being in front of a grey car but rather beside it or near its vicinity on the ground floor level where there are also people present. therefore, based solely on this information provided by common sense reasoning without additional assumptions:

candidate_answer: no",yes. the white thing is a thatched roof.
images/00/702.jpg,"tourists are posing in a room , ten of them are standing , one is squatting . one kid is posing with them , five other kids are sitting at a table and eating out of three bowls . there are posters and pictures at the wall behind the tourists .",Is the bowls touching the tourists?,YN,No,"Yes, No",2.0,True,no,no,no,no,"no

candidate_answers: no"
annotations/01/1348.eng,"Cobbled street , greenish hotel on the right a few people on the sidewalk car in the street",Are the people near the street?,YN,Yes,"Yes, No",2.0,True,yes,yes,yes,yes,"yes.

the context describes people on the sidewalk, which is a common place for people to gather."
annotations/01/1229.eng,"a room with yellow walls with a painting and some parts with natural stones there is a king-sized bed made of wood with light-pinkish bedcover and two white towels , a bedside lamp and a wooden chair",Is the lamp near to the bed?,YN,Yes,"Yes, No",,False,yes,yes,yes,"without specific details on the placement of the items in relation to each other within the room's layout, it is impossible for me as an ai with only text-based information and no visual access or further contextual clues about their arrangement. therefore, i cannot provide a definitive answer based solely on this description.","yes.

the lamp is near the bed."
annotations/00/846.eng,"a dark-skinned , dark-haired girl in a white tee-shirt is sitting at a desk in a classroom some sheets of paper are lying on the desk in front of her",Is the paper behind the white thing?,YN,No,"Yes, No",2.0,False,no,yes,no,"no. the context describes that there is something (a tee-shirt) directly covering or on top of some papers at her desk. therefore, it's not possible for paper to be behind this white object without being obscured by the darker items mentioned in the question. so, based on common sense reasoning and spatial understanding from context given, we can conclude that there is no paper 'behind' a tee-shirt or any other item described as covering it directly at her desk.","yes. the paper is behind the white thing.

the context describes a dark-skinned, dark-haired girl sitting at a desk, and some sheets of paper are lying on the desk in front of her."
images/01/1049.jpg,"exterior view of a light brown house , with stairs rising to the entrance of the second floor on the left , a tower with two small windows in the centre . there is an arch below the stairs leading to the entrance of the first floor . Exterior view of a light brown house , with stairs rising to the entrance of the second floor on the left , a tower with two small windows in the centre . There is an arch below the stairs leading to the entrance of the first floor. attached houses on the right . attached houses on the right. blue sky in the background .",Is the houses above the sky?,YN,No,"Yes, No",,True,no,no,no,yes,"no

the context describes an exterior view of a light brown house with stairs leading to the entrance of the second floor on the left, a tower with two small windows in the center, and an arch below the stairs leading to the entrance of the first floor. the context does not mention anything about the houses above the sky, so the answer is no."
images/00/970.jpg,"a dark-skinned , dark-haired boy with a big smile wearing a red cap and a dark blue anorak . a dark-skinned , dark-haired boy with a big smile wearing a red cap and a dark blue anorak. Short grass in background .",Is the grass behind the anorak?,YN,Yes,"Yes, No",,True,no,no,yes,yes,"yes.

the context describes a dark-skinned, dark-haired boy with a big smile wearing a red cap and a dark blue anorak. the background also has short grass."
images/00/992.jpg,"a dark-skinned , dark-haired girl in a white shirt in front of a painted wall . the painting shows a sunset behind a hill and a tree .",Is the white thing above the wall?,YN,No,"Yes, No",1.0,,no,yes,no,"no. the context describes that there is only one object mentioned as being ""white,"" which is her shirt. there's no mention of anything else on top of or above the wall in this description. therefore, based on common sense reasoning and spatial understanding from the given information, we can conclude it isn't a white thing located above the painted wall besides what has been explicitly mentioned (her dark-colored hair).","yes.

the white thing is above the wall."
annotations/00/796.eng,a dark-haired baby in the arms of a woman . baby wearing a red-and-white striped pyjama handprints on the wall in the background,Is the baby behind the handprints?,YN,No,"Yes, No",,False,no,yes,no,no,"yes.

the context describes a dark-haired baby in the arms of a woman, and there are handprints on the wall in the background that match the baby's handprints."
annotations/01/1216.eng,"a bungalow with two hammocks in front of the entrance and two trees next to it there are people at the entrance , and a meadow and a forest in the background",Is the hammocks behind the meadow?,YN,No,"Yes, No",,False,no,no,no,no,yes. the hammocks are behind the meadow.
annotations/01/1334.eng,"Room with two beds on the right , a table with two chairs on the left and a large window in the back there is also a mirror on the left",Is the window in front of the mirror?,YN,No,"Yes, No",,False,no,no,no,no,"yes.

the window is in front of the mirror."
images/01/1039.jpg,inside photograph of a room with a red carpet . inside photograph of a room with a red carpet. There is a wooden table and a wooden commode to the left . inside photograph of a room with a red carpet. There is a wooden table and a wooden commode to the left. A bed to the right . inside photograph of a room with a red carpet. There is a wooden table and a wooden commode to the left. A bed to the right. Two red armchairs with a round table on the left at the back . inside photograph of a room with a red carpet. There is a wooden table and a wooden commode to the left. A bed to the right. Two red armchairs with a round table on the left at the back. Further curtains and a standard lamp .,Is the table below the carpet?,YN,No,"Yes, No",,True,no,yes,no,no,"yes, the table is below the carpet."
annotations/00/845.eng,"a dark-skinned , dark-haired girl in a white shirt and black pants with black suspenders is sitting at her desk in a classroom some kids in the background are sitting at their desks",Is the desk near the black things?,YN,Yes,"Yes, No",1.0,True,no,yes,yes,"without specific details about the positioning of objects and people within the classroom setting described in your context, it's impossible to definitively determine whether ""the desk near the black things."" however, based on common sense reasoning that assumes a typical arrangement where students sit at their own or nearby desks (as implied by some kids sitting at their desks), one might infer:

answer: no","yes. the desk is near the black things.

the context describes a dark-skinned , dark-haired girl in a white shirt and black pants with black suspenders sitting at her desk in a classroom some kids in the background are sitting at their desks."
images/00/709.jpg,a destroyed house with the wreckage lying around in front it . three ordinary a bit elevated houses in the background .,Is the elevated houses behind the wreckage?,YN,Yes,"Yes, No",,True,yes,yes,yes,no,"no

candidate_answers: yes, no"
images/00/728.jpg,"Close-up photo of a building with a blue front , red doors , brown bricks below the windows and the wires that stick out from the roof . a few pupils are in front of the building .",Is the blue thing in front of the red thing,YN,Yes,"Yes, No",1.0,,no,yes,no,yes,yes. the blue thing is in front of the red thing.
annotations/00/847.eng,"a dark-skinned , dark-haired boy in a chequered shirt standing in a classroom kids sitting at their desk in the background",Is the chequered thing behind the kids?,YN,No,"Yes, No",2.0,False,no,yes,yes,"based on common sense reasoning and spatial awareness, it is likely that a dark-skinned boy in a classroom setting would be standing among other children who are sitting at their desks. therefore, considering typical room arrangements where objects like chequered shirts or rugs might not obstruct the space between students' seating areas and each student themselves:

answer: no","no

candidate_answers: yes, no"
images/00/952.jpg,"a dark-skinned , dark-haired girl with a black hat and a white pullover and a pink vest underneath a large purple cloth , in the backyard of a house .",Is the hat over the pink thing?,YN,Yes,"Yes, No",,True,no,yes,yes,no,yes. the hat is over the pink thing.
annotations/00/794.eng,"a dark-skinned , dark-haired girl wearing a yellow blouse with a blue collar handprints on the wall behind her",Is the yellow thing touching the girl?,YN,Yes,"Yes, No",1.0,True,no,yes,yes,no,"no

candidate_answers: yes, no"
annotations/01/1404.eng,"a room with a double bed made of wood , light pink walls , pillows and bedcovers there are night tables on both sides , a phone on the right , two lamps above the beds , a painting on the left and a window with a curtain on the very left",Is the bed far from the bedcovers?,YN,No,"Yes, No",1.0,True,no,no,no,no,"no

candidate_answers: yes, no"
annotations/01/1392.eng,"corner view of a dark yellow , two-storey house with white window and door frams and balconies with iron rails",Is the rails near to the white things?,YN,Yes,"Yes, No",,True,yes,yes,yes,"yes. the context implies that there are railings on both a porch (balcony) and possibly windows as well since it mentions ""white window and door frames"" which often have railing systems for safety reasons in multi-story homes. therefore, the iron rails would be near to these white elements of architecture.","no

candidate_answers: yes, no"
images/00/687.jpg,"panorama view of houses in La Paz . red roofed houses in the foreground , with a hill and rugged rocks in the background .",Are the Hill in front of the houses?,YN,No,"Yes, No",1.0,,no,no,no,yes,"yes.

the hill is in front of the houses."
annotations/01/1407.eng,"a three-storey building made of red bricks , with red doors and a blue jalousie on the ground level the uppermost level is still partly under construction",Is the construction above the blue thing?,YN,Yes,"Yes, No",2.0,False,yes,yes,yes,"yes. the context states that there's a ""blue jalousie on the ground level"" and it mentions an uppermost level which is still partly under construction but doesn't specify if this blue thing was constructed at or above its current location. however, since we know from common sense reasoning (and not explicitly stated in text) that constructions typically occur sequentially starting from bottom to top, one can infer the building would have been built before any decorative elements like a jalousie were added on ground level. therefore, it's reasonable to conclude construction is above this blue thing at present as per common sense reasoning and not just based on textual information alone.","yes.

the construction is above the blue thing."
annotations/00/826.eng,"a dark-skinned , dark-haired girl wearing a red coat is sitting at a desk in front of a building",Is the girl in the red thing?,YN,Yes,"Yes, No",,True,yes,yes,no,yes,"yes.

the context describes a dark-skinned , dark-haired girl wearing a red coat sitting at a desk in front of a building."
images/01/1029.jpg,"a man in white shirt , black jacket , grey pants and black shoes is sitting on a wooden chair and talking on the phone . on the right a wooden bed with white bedcovers . on the left ( before the man ) a wooden desk and a vase with flowers . there is a black brief-case in front of the chair , and there is also a picture hanging on the wall above the bed .",Is the man touching the phone?,YN,Yes,"Yes, No",1.0,,yes,yes,yes,"based on common sense reasoning, it's reasonable to assume that while talking on a phone, one might hold or rest their arm/hand against something for support. however, without explicit information about his actions in this context, we cannot definitively say he is touching the phone with certainty. therefore:

candidate_answer: no","no

candidate_answers: no"
annotations/01/1423.eng,a double bed made of wood with a light blue bedcover and light blue and white chequered pillows in a room with white walls there is a small carpet and a door on the left,Are the bedcovers near the bed?,YN,Yes,"Yes, No",1.0,True,yes,yes,yes,yes,yes. the bedcovers are near the bed.
annotations/00/851.eng,"a dark-skinned , dark-haired boy wearing a white shirt underneath a black pullover is standing in a classroom other kids are working in the background",Is the white thing in front of the kids?,YN,Yes,"Yes, No",,False,no,yes,yes,"no. the boy's shirt (white item) is underneath his black pullover and not visible to others as he stands with it on top of him in front of other kids. so based on common sense reasoning the white thing isn’t directly in front of them, but rather hidden by another layer of clothing - hence my answer: no.","no

candidate_answers: yes, no"
images/00/999.jpg,"a dark-skinned boy wearing a grey cap , a red and white striped shirt under a sleeveless grey vest with a black zip , black pants and runners is standing at a lookout and carrying a black bag in his right hand .",Is the red thing above the black thing?,YN,No,"Yes, No",,,no,yes,no,"the question seems to be asking about two items on the boy's body or accessories. however, there is no clear mention of a ""red"" and ""black"" item in proximity within the context provided. therefore, based on this information alone, we cannot definitively answer yes or no without making assumptions that are not supported by evidence from the text given.

candidate_answer: no","no

candidate_answers: yes, no"
annotations/01/1237.eng,"a room with a wooden king-sized bed , somewhat pale bedcovers and a large door with curtains on the left",Are the curtains to the left of the bed?,YN,Yes,"Yes, No",2.0,False,yes,yes,yes,"yes. the context states that there is ""a large door with curtains on the left,"" which implies that the curtains are indeed located to the left side of the bed in this room setup. therefore, based on common sense reasoning and spatial understanding, we can confidently answer 'yes' as per candidate_answers: yes.","yes.

the curtains are to the left of the bed."
annotations/00/808.eng,"a dark-skinned , dark-haired boy wearing a blue jumper with a yellow collar is standing in front of a brown door",Is the yellow thing touching the blue thing?,YN,Yes,"Yes, No",,True,no,yes,yes,"based on common sense reasoning and spatial understanding, without additional context suggesting otherwise, we can infer that it is unlikely for two distinct objects to be in direct contact. therefore, my response would be candidate_answer: no. however, if the yellow collar of his jumper was touching or attached directly to the blue part of another object (like a backpack), then yes, they could technically be considered as ""touching."" but with only the given context and assuming typical clothing arrangement where different pieces are not in direct contact:

candidate_answer: no","no

candidate_answers: yes, no"
annotations/00/801.eng,"a dark-skinned , dark-haired girl in a white tee-shirt with red edges",Is the girl have the white thing?,YN,No,"Yes, No",,True,yes,yes,yes,yes,"yes.

the context describes a dark-skinned , dark-haired girl in a white tee-shirt with red edges."
images/01/1315.jpg,a room with green walls . a room with green walls .Two single beds made of wood with green and blue bedcover and a night table with a bedside lamp in between . there is a window with white curtains on the left .,Is the window behind the white thing?,YN,Yes,"Yes, No",,True,no,no,no,"no. the context describes that the window has white curtains and it is located to the left of some objects (bedside lamp). it does not specify if these are behind anything green or blue bedcoverings on the beds; therefore we cannot conclude with certainty from this information alone whether something, specifically a ""white thing,"" is directly in front of the window. the answer must be based solely on given facts and common sense reasoning without making assumptions beyond them.","yes.

the window is behind the white thing."
annotations/01/1227.eng,"a room with brown-greyish walls , two single beds made of wood with bluish bedcover and pillows there is a night table between the beds , a lamp above each of the beds and a window with light green curtains in the background on the left",Is the lamp above the bluish thing?,YN,Yes,"Yes, No",2.0,False,no,no,no,"the question seems to be asking if there is a lamp directly over something blue. in this context, it's not explicitly stated that anything other than the bed itself and its coverings are bluish in color. therefore, based on common sense reasoning with given information, we can infer: 

no","yes.

the lamp is above the bluish thing."
