ID,Story,Question,Label,ollama/openchat,ollama/qwen,ollama/mistral
65,Q is directly above O. V is on the right side to Y. J is directly above Q. X is over there and Y is on the left. J is over there and V is on the top of it.,What is the relation of the agent J to the agent V?,below,down_right,top,"top (since j is directly above q, and q is directly above o, which means j is on the top of v)"
66,"Object D is above object K and to the right of it, too. J is above and to the right of Y. J is placed on the top of N. K is upper right to X. N is on the right and D is on the left.",What is the relation of the agent Y to the agent D?,overlap,down_right,the relation of the agent y to the agent d is opposite.,down_right (y is below and to the right of d)
67,"The object O is upper and slightly to the left of the object V. The object Y is positioned directly below the object T. If Y is the center of a clock face, D is located between 2 and 3. D is upper right to K. K is placed on the top of O.",What is the relation of the agent D to the agent V?,above,left,the relation of the agent d to the agent v is lower left.,top_left (d is positioned above and slightly to the left of v)
68,S is on the top of T and is on the same vertical plane. T and D are next to each other with D on the right and T on the left. C is over there with L above. C is there and B is at the 10 position of a clock face. S is on top of B.,What is the relation of the agent B to the agent L?,left,down_left,the relation of the agent b to the agent l is over there with l above.,the relation of the agent b to the agent l is top_left.
69,I is south west of M. T is north east of P. N is to the right of I horizontally. T is positioned above N and to the left. The objects M and U are over there. The object M is above and slightly to the right of the object U.,What is the relation of the agent N to the agent T?,lower-right,down_right,the relation of the agent n to the agent t is that t is positioned above n and to the left.,down_right
70,F is at the bottom and A is on the top. N is at the 6 o'clock position relative to W. A is at the bottom of B. W and B are next to each other with B on the right and W on the left. F is sitting in the left direction of D.,What is the relation of the agent A to the agent N?,right,top_right,the relation of the agent a to the agent n is that they are next to each other with b on the right and w on the left.,down_right
71,G is under H. M is diagonally to the upper right of Y. R is positioned right to M. The object G is positioned directly below the object X. R is to the left of X and below X at approximately a 45 degree angle.,What is the relation of the agent Y to the agent X?,lower-left,top_right,"your answer: 

y is diagonally to the upper right of x.",down_right
72,C presents upper left to Q. The object labeled S is positioned to the right of the object labeled V. Q is to the right and above T at an angle of about 45 degrees. C is to the top of B vertically. T is diagonally to the bottom right of V.,What is the relation of the agent S to the agent Q?,right,down_right,the relation of the agent s to the agent q is that q is to the right and above t at an angle of about 45 degrees.,top_right
73,Q is on the right side to R. M is sitting at the upper left position to W. Q is to the right of W horizontally. Z is placed on the top of M. R is positioned below F.,What is the relation of the agent R to the agent W?,overlap,down,the relation of the agent r to the agent w is right.,down
74,"F is on the left side to N. Z is over there and L is on the left. R is positioned below Q and to the left. F is at a 45 degree angle to Q, in the upper righthand corner. L is placed at the lower right of R.",What is the relation of the agent Q to the agent R?,lower-left,top_right,the relation of the agent q to the agent r is that r is positioned below q and to the left.,down_left
75,"P is on the left side of and below F. I is positioned up and to the right of H. I is directly south east of B. If F is the center of a clock face, O is located between 2 and 3. O is positioned in the lower left corner of H.",What is the relation of the agent F to the agent H?,lower-left,top_right,the relation of the agent f to the agent h is up and to the right.,down_left
76,"B and G are parallel, and B is on top of G. H is positioned left to U. H and Z are parallel, and H is to the left of Z. G is under Q. U and Q are parallel, and U is over Q.",What is the relation of the agent G to the agent Q?,below,down,g is under q.,down
77,C is to the bottom right of D. D is on the top side to Y. Y is positioned below E. X is positioned right to C. T is sitting at the 6:00 position to E.,What is the relation of the agent D to the agent T?,above,down_right,the relation of the agent d to the agent t is that they are both located on the top side to y.,down_right
78,D is diagonally right and above J. O is lower left to Q. E is over there and D is on the right. The object Q and E are there. The object E is above and slightly to the left of the object Q. J is over there and A is on the left.,What is the relation of the agent D to the agent O?,upper-right,top_right,the relation of the agent d to the agent o is lower left.,down_right
79,O is above T. B and U are in a horizontal line with B on the left. U is sitting in the left direction of Q. O is sitting at the upper left position to Q. A is over there and B is on the left.,What is the relation of the agent O to the agent T?,above,down,the relation of the agent o to the agent t is above.,top (or up)
80,M is there and R is at the 10 position of a clock face. M is placed in the right direction of U. R and Z are next to each other with Z on the right and R on the left. J is at X's 6 o'clock. J is over there with Z below.,What is the relation of the agent J to the agent X?,below,down_right,the relation of the agent j to the agent x is 'over there'.,down_left
81,The object labeled C is positioned to the right of the object labeled P. P is positioned up and to the right of B. C and W are horizontal and C is to the right of W. N is positioned above B and to the left. W is under D.,What is the relation of the agent W to the agent N?,right,down_left,the relation of the agent w to the agent n is below.,the relation of the agent w to the agent n is left.
82,V is positioned in the lower right corner of J. C is at the lower side of L. C presents lower right to J. The object V is positioned directly above the object A. B is south west of L.,What is the relation of the agent A to the agent C?,below,down_left,the relation of the agent a to the agent c is that they are both located in the lower right corner of j.,down_right
83,A is over there and C is directly below it. W is on the lower right of Z. The object X is positioned below and to the right of the object W. X is positioned above and to the left of Y. Z is at the bottom of C.,What is the relation of the agent X to the agent W?,lower-right,down_right,the relation of the agent x to the agent w is above and to the right.,down_right
84,H is to the left of I. I is over K. H is there and G is at the 10 position of a clock face. Z is to the top right of K. A presents upper right to Z.,What is the relation of the agent I to the agent K?,above,down_right,the relation of the agent i to the agent k is over.,down_left
85,B is at the 3 o'clock position relative to K. Y is on the same horizontal plane directly left to Z. A is sitting at the 3:00 position to N. N is on the right side to K. Y is below B and to the left of B.,What is the relation of the agent Z to the agent B?,below,down_left,down_left,down_left
86,B is there and O is at the 5 position of a clock face. The object N is positioned directly above the object B. J is on top of N. Z is above O at 2 o'clock. X and Z are both there with the object X is to the right of object Z.,What is the relation of the agent X to the agent O?,above,right,"the relation of the agent x to the agent o is ""right"".",the relation of the agent x to the agent o is top_right.
87,D is to the right of O horizontally. Y is there and T is at the 10 position of a clock face. I and T are in a vertical line with T below I. M is sitting at the lower right position to Y. The object I is positioned below and to the right of the object O.,What is the relation of the agent M to the agent I?,lower-right,down_right,the relation of the agent m to the agent i is that they are in a vertical line with t below i.,down_right
88,N is over there with I below. G is placed at the upper right of N. V is positioned above B. Y presents over B. G is below and to the right of Y.,What is the relation of the agent N to the agent G?,lower-left,top_right,the relation of the agent n to the agent g is below and to the right of y.,top_right
89,"P is there and O is at the 5 position of a clock face. If D is the center of a clock face, R is located between 7 and 8. Z is diagonally right and below D. Z and I are next to each other with Z on the left and I on the right. I is diagonally below P to the right at a 45 degree angle.",What is the relation of the agent I to the agent P?,lower-right,down_right,i is diagonally below p to the right at a 45 degree angle.,down_right
90,"R is sitting at the lower left position to T. S and I are parallel, and S is to the left of I. P is upper left of R. Object T is above object B and to the left of it, too. B is diagonally to the upper left of S.",What is the relation of the agent I to the agent P?,lower-right,down_right,down_left,the relation of the agent i to the agent p is down_right.
91,E and Q are both there with the object E is to the left of object Q. A and R are side by side with R at the bottom and A on the top. Q is positioned down and to the left of S. S is to the top right of G. G is sitting in the right direction of A.,What is the relation of the agent S to the agent R?,upper-right,down_left,the relation of the agent s to the agent r is opposite.,down_left
92,F is sitting in the left direction of G. U is to the right and above F at an angle of about 45 degrees. A is sitting at the upper right position to J. K and A are side by side with K on the top and A at the bottom. U is on the left and J is on the right.,What is the relation of the agent G to the agent A?,below,down_right,the relation of the agent g to the agent a is upper_right.,the relation of the agent g to the agent a is left.
93,"If T is the center of a clock face, S is located between 7 and 8. V is placed at the lower left of S. P is on the same horizontal plane directly right to A. B is above P at 10 o'clock. A is directly above T.",What is the relation of the agent S to the agent A?,lower-left,down_left,the relation of the agent s to the agent a is above.,down_left
94,C is to the right of G with a small gap between them. C is over there and P is directly above it. Y is placed at the lower right of G. Y is directly below E. W is diagonally above P to the left at a 45 degree angle.,What is the relation of the agent G to the agent C?,left,right,the relation of the agent g to the agent c is right.,the relation of the agent g to the agent c is 'right'.
95,"V is at the bottom and C is on the top. M is upper left of Y. If D is the center of a clock face, M is located between 10 and 11. D is on the top side to V. U and C are parallel, and C is below U.",What is the relation of the agent V to the agent M?,lower-right,down_left,the relation of the agent v to the agent m is that they are located between 10 and 11 on a clock face.,down
96,"S is sitting at the 9:00 position of K. S is under U. The object J is positioned directly above the object X. N is at a 45 degree angle to X, in the lower lefthand corner. U is on top of J.",What is the relation of the agent U to the agent J?,above,down,the relation of the agent u to the agent j is that u is on top of j.,down
97,"If Y is the center of a clock face, B is located between 10 and 11. Y is positioned below N and to the left. E is sitting at the 9:00 position of W. E is placed on the top of B. L is on the left side of and below N.",What is the relation of the agent L to the agent Y?,lower-left,down_left,"the relation of the agent l to the agent y is ""left"".",down_left
98,A is to the bottom left of G. X is on the same horizontal plane directly right to U. M is positioned below Z and to the left. The object A is upper and slightly to the left of the object U. X is at the bottom of M.,What is the relation of the agent X to the agent Z?,right,down_right,the relation of the agent x to the agent z is down_left.,down_right (x is below z and to the right)
99,P is to the right of K. Q and P are vertical and Q is below P. Q and R are horizontal and Q is to the right of R. R is on the top and L is at the bottom. Z is at the bottom of K.,What is the relation of the agent Q to the agent P?,below,down,the relation of the agent q to the agent p is right.,down