ID,Story,Question,Label,ollama/openchat,ollama/qwen,ollama/mistral
0,U is to the bottom right of A. A is south west of F. K is to the upper left of F. I is positioned left to T. U is above and to the left of I.,What is the relation of the agent U to the agent A?,lower-right,bottom_right,the relation of the agent u to the agent a is south west.,up_right
1,R is on the right side and below M. V is on the lower left of D. R is sitting at the 3:00 position to P. D is diagonally to the bottom right of M. V is on the top of I and is on the same vertical plane.,What is the relation of the agent D to the agent V?,upper-right,down_right,down_left,"down_right (or simply right for short-hand notation, as the direction is clear from context)"
2,L and U are side by side with L to the left and U to the right. U is placed in the right direction of M. C is diagonally to the bottom right of L. G is directly below C. G and S are side by side with G to the right and S to the left.,What is the relation of the agent U to the agent C?,above,top_right,the relation of the agent u to the agent c is diagonally to the bottom right of l.,top_right
3,Y is on the right side and top of D. J is sitting at the lower right position to V. V is placed at the upper left of D. Z is at Y's 12 o'clock. X and J are in a vertical line with J below X.,What is the relation of the agent Z to the agent V?,upper-right,top_right,the relation of the agent z to the agent v is top_left.,top_left
4,E and B are next to each other with B on the right and E on the left. The object E and T are there. The object E is below and slightly to the right of the object T. G is to the right of F and is on the same horizontal plane. B is to the bottom-left of G. X is placed at the lower right of F.,What is the relation of the agent G to the agent F?,right,right,the relation of the agent g to the agent f is that g is to the right of f and is on the same horizontal plane.,the relation of the agent g to the agent f is right. (g is to the right of f)
5,Z is at T's 6 o'clock. G and A are both there with the object A below the object G. D is over there and Z is on the right of it. V is to the bottom left of T. The objects A and V are over there. The object A is lower and slightly to the left of the object V.,What is the relation of the agent G to the agent D?,left,top_right,the relation of the agent g to the agent d is above.,top_right
6,E and Z are side by side with E to the right and Z to the left. B and C are in a vertical line with B on top. Y is above E at 2 o'clock. Z is sitting in the left direction of N. C is to the bottom-left of N.,What is the relation of the agent N to the agent C?,upper-right,down_right,the relation of the agent n to the agent c is down_left.,down_left
7,C and G are in a horizontal line with C on the left. The object E is lower and slightly to the left of the object R. The object J is upper and slightly to the left of the object R. C presents upper right to T. J is to the top-right of G.,What is the relation of the agent T to the agent G?,lower-left,top_left,top_ right,top_left (t is above and to the left of g)
8,M and I are next to each other with I on the right and M on the left. S is on the left side to T. S is placed at the lower left of I. D is below and to the left of M. Q is diagonally above D to the right at a 45 degree.,What is the relation of the agent S to the agent M?,below,down_left,the relation of the agent s to the agent m is that they are next to each other with i on the right and m on the left.,down_left
9,"Z is positioned up and to the right of V. C is positioned left to M. O and Z are next to each other with O on the left and Z on the right. C and W are parallel, and C is over W. Object O is below object W and to the left of it, too.",What is the relation of the agent M to the agent V?,upper-right,down_left,the relation of the agent m to the agent v is that they are next to each other with m on the left and v on the right.,the relation of the agent m to the agent v is left.
10,"G is sitting at the upper right position to C. M and C are parallel, and M is to the right of C. S is directly south west of M. W is placed in the left direction of G. W is over there and E is on the right.",What is the relation of the agent W to the agent M?,upper-right,down_left,the relation of the agent w to the agent m is that w is to the left of m.,the relation of the agent w to the agent m is left.
11,"Y is at the 6 o'clock position relative to S. Q and Y are side by side with Y at the bottom and Q on the top. The object S is positioned above and to the right of the object M. M is sitting at the upper right position to G. If G is the center of a clock face, P is located between 10 and 11.",What is the relation of the agent S to the agent G?,upper-right,down_right,the relation of the agent s to the agent g is above and to the right.,top_right
12,"E is sitting at the upper right position to C. S is diagonally below C to the left at a 45 degree angle. If O is the center of a clock face, U is located between 4 and 5. T is over there and O is directly below it. T and S are next to each other with S at the bottom T on the top.",What is the relation of the agent C to the agent U?,above,down_right,the relation of the agent c to the agent u is that they are located between 4 and 5.,down_right
13,"S and U are next to each other with S on the top and U at the bottom. O is positioned up and to the right of W. If G is the center of a clock face, U is located between 10 and 11. The object G is upper and slightly to the right of the object W. Object S is above object M and to the left of it, too.",What is the relation of the agent G to the agent S?,lower-right,top_right,the relation of the agent g to the agent s is top.,top_right
14,"V and R are parallel, and R is below V. U and R are next to each other with U on the left and R on the right. U is at L's 3 o'clock. I and V are horizontal and I is to the left of V. Y is to the left of I.",What is the relation of the agent V to the agent U?,upper-right,top_right,the relation of the agent v to the agent u is next_to each other with u on the left and r on the right.,down
15,"L is sitting at the 6:00 position to G. I is at a 45 degree angle to L, in the upper lefthand corner. Z is to the left of M with a small gap between them. R is to the bottom-left of I. Z and R are horizontal and Z is to the right of R.",What is the relation of the agent L to the agent G?,below,down,top,down
16,J is slightly off center to the top left and S is slightly off center to the bottom right. W is positioned right to X. Z is diagonally to the bottom right of R. J is below and to the right of Z. R is on the right side and top of X.,What is the relation of the agent W to the agent R?,below,left,the relation of the agent w to the agent r is right.,the relation of the agent w to the agent r is right.
17,B is to the left of M and is on the same horizontal plane. Q is directly north west of B. M and U are side by side with U at the bottom and M on the top. I is over there and A is directly below it. U is at the 3 o'clock position relative to A.,What is the relation of the agent I to the agent Q?,lower-right,down_right,the relation of the agent i to the agent q is north west.,the relation of the agent i to the agent q is west.
18,B is positioned left to Z. F is below S and to the left of S. H and Z are in a vertical line with Z below H. B is sitting in the right direction of V. S is positioned in the front right corner of V.,What is the relation of the agent B to the agent F?,right,left,the relation of the agent b to the agent f is below.,left
19,W is to the right of K with a small gap between them. I is lower left to N. W is diagonally below H to the left at a 45 degree angle. N is placed at the lower left of X. The object H is upper and slightly to the right of the object X.,What is the relation of the agent X to the agent I?,upper-right,down_left,the relation of the agent x to the agent i is lower left.,down_left
20,Z is to the right of M with a small gap between them. The object P and R are there. The object P is below and slightly to the right of the object R. M is directly above R. B is on the lower left of Z. P is at the bottom of H.,What is the relation of the agent H to the agent Z?,below,down_left,down,down_right (h is below and slightly to the right of z)
21,"Y is diagonally to the bottom left of R. The object G is upper and slightly to the left of the object B. M and Y are parallel, and M is to the left of Y. G is at the bottom of J vertically. R and B are parallel, and R on the left of B.",What is the relation of the agent G to the agent M?,upper-right,down_left,the relation of the agent g to the agent m is that they are parallel.,top_left
22,"Object R is above object U and to the right of it, too. G is diagonally to the upper left of B. X is at the lower side of B. D is at R__ 9 o'clock. G is positioned below U.",What is the relation of the agent B to the agent D?,lower-right,down_left,the relation of the agent b to the agent d is that they are located in different locations on a map.,down_right
23,V presents lower right to B. X is over there with O below. W is above B at 2 o'clock. V and H are vertical and V is above H. O is positioned below and to the right of W.,What is the relation of the agent H to the agent X?,lower-left,left,the relation of the agent h to the agent x is down_left.,down_right (h is below and to the right of x)
24,H is to the right and above Y at an angle of about 45 degrees. M is diagonally above J to the right at a 45 degree. Y is on top of X. The object R is upper and slightly to the left of the object J. X and R are side by side with X on the top and R at the bottom.,What is the relation of the agent J to the agent Y?,lower-right,down_right,the relation of the agent j to the agent y is that they are side by side with x on the top and r at the bottom.,"down_right (since y is on top of x, and j is diagonally above x to the right, which means it's below y in a diagonal direction)"
25,L is directly south west of N. Q is over there and O is on the top of it. L is under F. N and H are horizontal and N is to the right of H. O is upper left of H.,What is the relation of the agent O to the agent Q?,above,down_right,down_left,down_left (o is below and to the left of q)
26,"K and C are vertical and K is below C. If K is the center of a clock face, B is located between 10 and 11. W is directly north west of O. Z is positioned above O and to the right. W is there and B is at the 2 position of a clock face.",What is the relation of the agent C to the agent B?,right,down_left,"the relation of the agent c to the agent b is that b is located between 10 and 11, which means that b is on the right side of 10, and on the left side of 11.",top_right
27,U is to the left of Y horizontally. L is below and to the right of J. Y is placed on the top of S. G and L are in a horizontal line with G on the left. U is on the left side and above J.,What is the relation of the agent G to the agent U?,lower-right,right,"the relation of the agent g to the agent u is that g is on the left side and above j, while u is on the left side and above j.",top_left
28,P presents over T. E presents below S. G is over D. E is positioned in the lower right corner of P. T is positioned up and to the right of G.,What is the relation of the agent G to the agent S?,lower-left,down_right,the relation of the agent g to the agent s is below.,down_right
29,S is diagonally right and above U. Q is at D's 3 o'clock. D is sitting at the top position to V. V and S are horizontal and V is to the left of S. U and F are side by side with F at the bottom and U on the top.,What is the relation of the agent D to the agent S?,upper-left,down_right,the relation of the agent d to the agent s is diagonal right and above.,top_right
30,The object R is upper and slightly to the right of the object M. Q is diagonally above R to the left at a 45 degree angle. X is diagonally to the upper right of Q. Z is placed at the upper right of X. The object A is positioned below and to the right of the object M.,What is the relation of the agent R to the agent A?,above,down_right,the relation of the agent r to the agent a is lower and to the left.,down_right
31,The object V is lower and slightly to the left of the object W. U is to the right of V with a small gap between them. Y is to the left of W and below W at approximately a 45 degree angle. Y is below N at 4 o'clock. U is sitting in the left direction of H.,What is the relation of the agent N to the agent W?,left,top_right,the relation of the agent n to the agent w is that they are opposite each other.,down_left
32,"If E is the center of a clock face, H is located between 4 and 5. E is diagonally right and above C. O is on top of Y. N is above C at 2 o'clock. H is to the upper left of O.",What is the relation of the agent C to the agent E?,lower-left,down_right,the relation of the agent c to the agent e is diagonally right and above c.,up_left
33,"If W is the center of a clock face, E is located between 2 and 3. T is on the left side of and below W. S is below T at 7 o'clock. J is at the 12 o'clock position relative to E. D is on the left and S is on the right.",What is the relation of the agent W to the agent J?,lower-left,top_right,top_12,top_left
34,"Y is at a 45 degree angle to E, in the upper righthand corner. The object V is positioned directly above the object C. O is diagonally right and below T. O is over there with C above. T is lower left to Y.",What is the relation of the agent T to the agent Y?,lower-left,down_left,the relation of the agent t to the agent y is down_left.,down_left (t is lower left to y)
35,Q is to the bottom right of B. N is positioned below L. L is over Q. T is sitting at the lower position to C. T is at the bottom of B vertically.,What is the relation of the agent N to the agent T?,right,down_right,"your answer: 

the relation between the agents n and t is that n is positioned below l, while t is sitting at the lower position to c. therefore, the relation between n and t is ""below"".",down
36,"V is to the right and above N at an angle of about 45 degrees. N is placed in the right direction of I. V is north east of F. R and I are parallel, and I is below R. F is on the upper right of X.",What is the relation of the agent V to the agent N?,upper-left,top_right,"the relation of the agent v to the agent n is that v is north east of f, which means that v is above and to the north-east of f. therefore, the relation of the agent v to the agent n is that v is above and to the north-east of f.",top_right
37,V is directly north east of M. C and S are side by side with S at the bottom and C on the top. M is to the top of K vertically. K and E are in a horizontal line with E on the right. V is to the left of S with a small gap between them.,What is the relation of the agent E to the agent S?,lower-left,down_right,the relation of the agent e to the agent s is that they are side by side with s at the bottom and c on the top.,"the relation of the agent e to the agent s is right, as they are side by side with s at the bottom and c on the top, and e is on the right."
38,"O is at a 45 degree angle to S, in the lower lefthand corner. D is on the lower right of V. A is to the right of P horizontally. S is lower right of D. V is to the top-left of P.",What is the relation of the agent S to the agent A?,below,down_right,the relation of the agent s to the agent a is that a is to the right of p horizontally.,down_right
39,"Y is directly above L. L is on the same vertical plane directly above N. Object I is above object R and to the right of it, too. I and Y are in a vertical line with I on top. R is diagonally to the upper left of Q.",What is the relation of the agent R to the agent Q?,upper-left,down_left,r is diagonally to the upper left of q.,down_left (r is diagonally to the upper left of q)
40,L and M are side by side with L to the right and M to the left. E and Q are vertical and E is below Q. V is sitting at the lower right position to M. Q is below and to the left of L. R is diagonally to the bottom left of V.,What is the relation of the agent M to the agent R?,above,down_right,the relation of the agent m to the agent r is diagonal to the bottom left of v.,down_left
41,"F and D are next to each other with D on the right and F on the left. M is on the right and A is on the left. L and D are parallel, and L is on top of D. The object B is positioned directly below the object F. B is at the 12 o'clock position relative to M.",What is the relation of the agent B to the agent F?,below,down,the relation of the agent b to the agent f is that b is positioned directly below f.,down
42,Y and O are side by side with Y to the right and O to the left. S and Y are in a vertical line with S on top. Z is on the top of S and is on the same vertical plane. W is over there and Z is on the right. E and O are side by side with E to the right and O to the left.,What is the relation of the agent Z to the agent E?,above,top_right,the relation of the agent z to the agent e is opposite.,the relation of the agent z to the agent e is top_right.
43,"Y is on the right side and below V. T and A are in a vertical line with T on top. V is positioned right to O. Object F is above object Y and to the left of it, too. A is directly above F.",What is the relation of the agent V to the agent F?,overlap,down_right,"the relation of the agent v to the agent f is that v is positioned right to o, which is also the position of f. therefore, v and f are in a vertical line with v on top.",the relation of the agent v to the agent f is right.
44,H is to the bottom right of R. A is diagonally to the upper left of S. S and R are horizontal and S is to the left of R. The object F is lower and slightly to the left of the object P. A is there and F is at the 10 position of a clock face.,What is the relation of the agent H to the agent R?,lower-right,bottom_right,the relation of the agent h to the agent r is bottom right.,down_right
45,H is at A__ 9 o'clock. B is to the bottom-left of H. K is above Q. K is at the bottom of B and is on the same vertical plane. Q is positioned left to J.,What is the relation of the agent Q to the agent K?,below,down_right,the relation of the agent q to the agent k is down_left.,the relation of the agent q to the agent k is left.
46,G is to the right of O horizontally. Y is at the bottom of V and is on the same vertical plane. C is to the bottom-right of G. C is on the left side of and below V. O is on the top and Z is at the bottom.,What is the relation of the agent G to the agent C?,upper-left,right,the relation of the agent g to the agent c is bottom-_.,down_right
47,"J is sitting at the 6:00 position to D. M is at a 45 degree angle to K, in the upper righthand corner. M is directly south west of U. D and K are side by side with D on the top and K at the bottom. U is upper right to R.",What is the relation of the agent K to the agent J?,overlap,down_right,the relation of the agent k to the agent j is down_left.,down
48,N is over there and Z is at the bottom of it. W is at the 9 o'clock position relative to Z. G is positioned up and to the right of N. W is to the upper left of S. A is on the top of G and is on the same vertical plane.,What is the relation of the agent S to the agent A?,lower-left,down_left,"the relation of the agent s to the agent a is ""on the same vertical plane"".",the relation of the agent s to the agent a is down.
49,"Object Q is below object O and to the right of it, too. P is on the right and R is on the left. R is diagonally to the upper left of Q. K is below L. O and K are in a horizontal line with K on the right.",What is the relation of the agent L to the agent Q?,above,down_right,the relation of the agent l to the agent q is that they are diagonally to each other.,down_left
50,"R and N are parallel, and R is to the left of N. F presents lower right to B. M is positioned above B. O is over there and M is at the bottom of it. O is on the right side and below R.",What is the relation of the agent O to the agent F?,upper-left,down_right,down_left,down_right
51,"Object K is above object G and to the right of it, too. G and N are both there with the object G is to the left of object N. Y is on the left side of and below Z. D is on the upper right of Z. D is diagonally to the upper left of K.",What is the relation of the agent N to the agent D?,lower-right,down_left,the relation of the agent n to the agent d is diagonal to the upper left of k.,top_left (n is above and to the left of d)
52,The object V is positioned below and to the right of the object K. G is sitting at the 9:00 position of D. P is to the top right of U. P is directly above D. G is positioned below V and to the left.,What is the relation of the agent U to the agent D?,left,down_right,"the relation of the agent u to the agent d is that they are both located directly above each other. therefore, the relation between u and d is top.",down_right
53,"Q and H are parallel, and Q is to the left of H. E is sitting at the 12:00 position to H. B is positioned in the lower left corner of E. M is to the bottom left of Y. B is to the left of Y horizontally.",What is the relation of the agent Y to the agent H?,overlap,down_left,"your answer: 

h is to the right of y.",down_left (or south and left)
54,W and J are side by side with J at the bottom and W on the top. N is to the bottom-left of W. E is below and to the right of Z. K is diagonally left and below N. The object E and K are there. The object E is below and slightly to the right of the object K.,What is the relation of the agent K to the agent E?,upper-left,down_left,the relation of the agent k to the agent e is diagonally left and below n.,down_left
55,"Q is positioned below Z and to the right. J and Q are parallel, and J is under Q. C is placed at the lower left of M. Z is placed at the upper right of M. J is to the left of K horizontally.",What is the relation of the agent Q to the agent K?,upper-left,right,"your answer: 

j is to the left of k horizontally.",down_right (q is below and to the right of k)
56,"I is sitting at the upper right position to R. M and J are parallel, and M is on top of J. M is sitting at the 9:00 position of W. The object Z is positioned directly below the object R. The object Z is positioned below and to the left of the object J.",What is the relation of the agent I to the agent R?,upper-right,right,the relation of the agent i to the agent r is that they are parallel.,top_right
57,N is over there with K below. K presents upper left to W. The object F and Q are there. The object F is below and slightly to the right of the object Q. W is on the lower left of Q. N is positioned up and to the right of T.,What is the relation of the agent F to the agent W?,right,down_right,the relation of the agent f to the agent w is that they are on opposite sides of each other.,down_right
58,O is positioned below and to the right of X. Y is to the right and above F at an angle of about 45 degrees. D is above X at 10 o'clock. P is to the right and above F at an angle of about 45 degrees. O presents upper right to Y.,What is the relation of the agent O to the agent D?,lower-right,down_right,the relation of the agent o to the agent d is above.,down_right
59,"K is over there and Q is on the left of it. W is positioned below Q and to the left. W and X are parallel, and W is over X. M and I are parallel, and M on the left of I. I is to the top-right of K.",What is the relation of the agent K to the agent I?,lower-left,top_left,i is to the top-_ of k.,top_right
60,"X is upper left of P. C is sitting at the top position to Z. C is to the left of W and below W at approximately a 45 degree angle. U presents right to X. W is at a 45 degree angle to U, in the upper righthand corner.",What is the relation of the agent U to the agent X?,right,right,the relation of the agent u to the agent x is right.,top_right
61,"O is at the lower side of R. R is to the right of P and is on the same horizontal plane. P is above and to the right of M. O is at a 45 degree angle to Z, in the lower righthand corner. C is below M at 7 o'clock.",What is the relation of the agent C to the agent R?,lower-left,down_left,the relation of the agent c to the agent r is below.,down_left (c is below and to the left of r)
62,The object labeled D is positioned to the left of the object labeled Y. D presents upper left to U. Y is diagonally to the bottom left of M. J is sitting at the lower left position to V. V is above U with a small gap between them.,What is the relation of the agent V to the agent D?,right,down_left,the relation of the agent v to the agent d is that v is above d with a small gap between them.,down_left
63,The objects W and F are over there. The object W is above and slightly to the right of the object F. V is positioned left to F. W is over there and E is on the top of it. B and A are side by side with A at the bottom and B on the top. V is over there and B is on the right of it.,What is the relation of the agent F to the agent B?,overlap,left,the relation of the agent f to the agent b is opposite.,the relation of the agent f to the agent b is 'left'.
64,H is above J and to the left of J. G is there and S is at the 10 position of a clock face. H is directly south east of P. J is to the left of E. P is placed in the left direction of G.,What is the relation of the agent S to the agent H?,left,top_right,the relation of the agent s to the agent h is that h is above j and to the left of j.,"down_right (since s is at the 10 position on a clock face, which corresponds to the ""down"" direction, and h is above j, which means h is in the ""up"" or ""north"" direction, so h is directly south of s)"
